
1754,03-3-23,dairy,Coffee-Mate Coffee Creamer Zero Sugar Italian Sweet Creme  Fluid ounceOpen ,$7.79,cub
1755,03-3-23,dairy,Planet Oat Oatmilk Original Extra Creamy  Fluid ounceOpen ,$6.49,cub
1756,03-3-23,dairy,Coffee-Mate Coffee Creamer Rice Krispies Treats  Fluid ounceOpen ,$4.49,cub
1757,03-3-23,dairy,Chobani Coffee Creamer Plant Based Caramel Macchiato Flavored  Fluid ounceOpen ,$5.49,cub
1758,03-3-23,dairy,Coffee-Mate Coffee Creamer Fat Free French Vanilla   ,$4.49,cub
1759,03-3-23,dairy,Reddi Wip Dairy Whipped Topping Zero Sugar . ,$3.59,cub
1760,03-3-23,dairy,Califia Farms Almondmilk Unsweetened  Fluid ounceOpen ,$4.49,cub
1761,03-3-23,dairy,Coffee-Mate Coffee Creamer Cinnamon Toast Crunch  ,$4.49,cub
1762,03-3-23,dairy,International Delight Coffee Creamer Zero Sugar French Vanilla  Fluid ounceOpen ,$4.99,cub
1763,03-3-23,dairy,Califia Farms Almondmilk Blend Toasted Coconut  Fluid ounceOpen ,$4.49,cub
1764,03-3-23,dairy,Chobani Coffee Creamer Hazelnut Flavored  Fluid ounceOpen ,$5.49,cub
1765,03-3-23,dairy,Horizon  Organic Milk Organic Lowfat % . GallonOpen ,$5.99,cub
1766,03-3-23,dairy,Silk Soy Creamer Dairy-Free Vanilla  Fluid ounceOpen ,$5.99,cub
1767,03-3-23,dairy,Wild Harvest Milk Organic Reduced Fat % Milkfat . GallonOpen ,$4.99,cub
1768,03-3-23,dairy,Chobani Oatmilk Zero Sugar Original  Fluid ounceOpen ,$4.99,cub
1769,03-3-23,dairy,International Delight Coffee Creamer Amaretto  Fluid ounceOpen ,$4.99,cub
1770,03-3-23,dairy,Planet Oat Oatmilk Vanilla  ,$4.39,cub
1771,03-3-23,dairy,Shamrock Farms Protein Shake Strawberry Builder  Fluid ounceOpen ,$2.59,cub
1772,03-3-23,dairy,Wild Harvest Milk Reduced Fat  GallonOpen ,$7.29,cub
1773,03-3-23,dairy,Chobani Coffee Creamer Peppermint Mocha Flavored  Fluid ounceOpen ,$5.49,cub
1774,03-3-23,dairy,Lactaid Whole Milk Chocolate . GallonOpen ,$4.49,cub
1775,03-3-23,dairy,Planet Oat Unsweetened Vanilla Oatmilk  Fluid ounceOpen ,$4.39,cub
1776,03-3-23,dairy,Essential Everyday Dairy Whipped Topping Original . ,$3.29,cub
1777,03-3-23,dairy,Planet Oat Oatmilk Original  Fluid ounceOpen ,$6.49,cub
1778,03-3-23,dairy,Coffee Mate Coffee Creamer Cinnamon Vanilla Creme  ,$4.49,cub
1779,03-3-23,dairy,Chobani Coffee Creamer French Vanilla  Fluid ounceOpen ,$5.49,cub
1780,03-3-23,dairy,Organic Valley Milk Lowfat Organic  GallonOpen ,$9.69,cub
1781,03-3-23,dairy,Califia Farms Almondmilk Unsweetened Vanilla  Fluid ounceOpen ,$4.49,cub
1782,03-3-23,dairy,So Delicious Coconutmilk Creamer Organic French Vanilla  ,$6.19,cub
1783,03-3-23,dairy,Silk Oatmilk Original  Fluid ounceOpen ,$5.39,cub
1784,03-3-23,dairy,Coffee-Mate Coffee Creamer Zero Sugar Cinnamon Roll  Fluid ounceOpen ,$4.49,cub
1785,03-3-23,dairy,Autumnwood % Milk  Fluid ounceOpen ,$4.99,cub
1786,03-3-23,dairy,TruMoo Whole Milk Whole Chocolate  ,$1.25,cub
1787,03-3-23,dairy,Horizon Organic Milk Lowfat Organic Chocolate . GallonOpen ,$5.99,cub
1788,03-3-23,dairy,Califia Farms Creamer Almondmilk French Vanilla . Fluid ounceOpen ,$5.79,cub
1789,03-3-23,dairy,Everyday Essential Lactose Free Whole Milk  Fluid ounceOpen ,$4.99,cub
1790,03-3-23,dairy,Silk Creamer Dairy-Free Oat Vanilla  Fluid ounceOpen ,$5.49,cub
1791,03-3-23,dairy,Organic Valley Milk Reduced Fat % Milkfat  GallonOpen ,$9.69,cub
1792,03-3-23,dairy,Silk Vanilla Oatmilk  Fluid ounceOpen ,$5.39,cub
1793,03-3-23,dairy,Wild Harvest Milk Lowfat  GallonOpen ,$7.29,cub
1794,03-3-23,dairy,International Delight Coffee Creamer Hazelnut  Fluid ounceOpen ,$7.79,cub
1795,03-3-23,dairy,Lactaid Milk % Reduced Fat Protein  Fluid ounceOpen ,$4.49,cub
1796,03-3-23,dairy,Organic Valley Organic Valley Grassmilk Organic % Reduced Fat Milk . GallonOpen ,$7.39,cub
1797,03-3-23,dairy,Horizon Organic Milk Organic Reduced Fat . GallonOpen ,$5.99,cub
1798,03-3-23,dairy,Silk Almondmilk Unsweet  Fluid ounceOpen ,$5.99,cub
1799,03-3-23,dairy,Silk Creamer Dairy-Free Soy Original  Fluid ounceOpen ,$5.99,cub
1800,03-3-23,dairy,Chobani Coffee Creamer Chocolate Hazelnut  Fluid ounceOpen ,$5.49,cub
1801,03-3-23,dairy,Shamrock Farms Protein Shake Vanilla  ,$2.59,cub
1802,03-3-23,dairy,TruMoo Milk Lowfat Vanilla % Milkfat  ,$1.25,cub
1803,03-3-23,dairy,Silk Oatmilk Unsweet  Fluid ounceOpen ,$5.39,cub
1804,03-3-23,dairy,Silk Almondmilk Extra Creamy Unsweet  Fluid ounceOpen ,$3.99,cub
1805,03-3-23,dairy,International Delight Coffee Creamer Zero Sugar Hazelnut  Fluid ounceOpen ,$4.99,cub
1806,03-3-23,dairy,TruMoo Milk Lowfat Chocolate % Milkfat  ,$1.25,cub
1807,03-3-23,dairy,Chobani Coffee Creamer Sweet & Creamy  Fluid ounceOpen ,$5.49,cub
1808,03-3-23,dairy,Califia Farms Coconut Cream & Almondmilk Unsweetened . Fluid ounceOpen ,$3.89,cub
1809,03-3-23,dairy,Almond Breeze Almondmilk Extra Creamy  Fluid ounceOpen ,$3.49,cub
1810,03-3-23,dairy,Planet Oat Oatmilk Dark Chocolate  ,$4.39,cub
1811,03-3-23,dairy,Wild Harvest Milk Fat Free  GallonOpen ,$7.29,cub
1812,03-3-23,dairy,Lactaid Milk Fat Free  ,$6.99,cub
1813,03-3-23,dairy,Oatly Low Fat Oatmilk  Fluid ounceOpen ,$5.99,cub
1814,03-3-23,dairy,Sport Shake Protein Shake Vanilla  ,$2.19,cub
1815,03-3-23,dairy,Coffee-Mate Coffee Creamer Fat Free Hazelnut   ,$4.49,cub
1816,03-3-23,produce,Bluewater Farms Fresh Cranberries  ,$2.99,cub
1817,03-3-23,produce,Bluewater Farms Fresh Cranberries  ,$2.99,cub
1818,03-3-23,produce,Bluewater Farms Fresh Cranberries  ,$2.99,cub
1819,03-3-23,produce,Fresh Sumo Mandarins . PoundOpen ,$2.00 avg/ea,cub
1820,03-3-23,produce,Naturipe Farms Blueberries - Organic  ,$3.00,cub
1821,03-3-23,produce,Naturipe Farms Blueberries - Organic  ,$3.00,cub
1822,03-3-23,produce,Naturipe Farms Blueberries - Organic  ,$3.00,cub
1823,03-3-23,produce,Produce Apple Honeycrisp . PoundOpen ,$1.50 avg/ea,cub
1824,03-3-23,produce,Produce Apple Pink Lady . PoundOpen ,$0.78 avg/ea,cub
1825,03-3-23,produce,Produce Bananas . PoundOpen ,$0.28 avg/ea,cub
1826,03-3-23,produce,Produce Bananas . PoundOpen ,$0.28 avg/ea,cub
1827,03-3-23,produce,Produce Bananas . PoundOpen ,$0.28 avg/ea,cub
1828,03-3-23,produce,Produce Clementine's Bagged  PoundOpen ,$5.99,cub
1829,03-3-23,produce,Produce Grapefruit   ,$2.99,cub
1830,03-3-23,produce,Produce Green Seedless Grapes . PoundOpen ,$4.98 avg/ea,cub
1831,03-3-23,produce,Produce Heirloom Navel Orange   ,$1.29,cub
1832,03-3-23,produce,Produce Heirloom Navel Orange   ,$1.29,cub
1833,03-3-23,produce,Produce Heirloom Navel Orange   ,$1.29,cub
1834,03-3-23,produce,Produce Lemon   ,$0.99,cub
1835,03-3-23,produce,Produce Lime   ,$0.99,cub
1836,03-3-23,produce,Produce Pear Bartlett . PoundOpen ,$0.80 avg/ea,cub
1837,03-3-23,produce,Produce Pear Bartlett . PoundOpen ,$0.80 avg/ea,cub
1838,03-3-23,produce,Produce Pear Bartlett . PoundOpen ,$0.80 avg/ea,cub
1839,03-3-23,produce,Produce Red Seedless Grapes . PoundOpen ,$4.98 avg/ea,cub
1840,03-3-23,produce,Produce Apple Cosmic Crisp . PoundOpen ,$1.50 avg/ea,cub
1841,03-3-23,produce,Produce Apple Cosmic Crisp . PoundOpen ,$1.50 avg/ea,cub
1842,03-3-23,produce,Produce Apple Cosmic Crisp . PoundOpen ,$1.50 avg/ea,cub
1843,03-3-23,produce,Fresh Honey Bear Cubbie Honeycrisp Apples  PoundOpen ,$7.99,cub
1844,03-3-23,produce,Produce Cantaloupe Large   ,$4.99,cub
1845,03-3-23,produce,Produce Naval Orange Cara Red   ,$1.29,cub
1846,03-3-23,produce,Produce Apple Granny Smith . PoundOpen ,$1.25 avg/ea,cub
1847,03-3-23,produce,PCN MandaRosa  PoundOpen ,$5.99,cub
1848,03-3-23,produce,Produce Red Mango   ,$2.00,cub
1849,03-3-23,produce,Quick and Easy Pineapple Chunks Fresh Cut  Ounce   ,$6.49,cub
1850,03-3-23,produce,Sunkist Oranges Navel  PoundOpen ,$7.99,cub
1851,03-3-23,produce,Produce Kiwi   ,$0.99,cub
1852,03-3-23,produce,naturipe Strawberries Organic  GramOpen ,$7.99,cub
1853,03-3-23,produce,naturipe Strawberries Organic  GramOpen ,$7.99,cub
1854,03-3-23,produce,naturipe Strawberries Organic  GramOpen ,$7.99,cub
1855,03-3-23,produce,Produce Apple Jazz . PoundOpen ,$1.25 avg/ea,cub
1856,03-3-23,produce,Driscoll's  Sweetest Batch Blueberries  ,$9.99,cub
1857,03-3-23,produce,Driscoll's Organic Blackberries  ,$5.99,cub
1858,03-3-23,produce,Produce Apple Pazazz . PoundOpen ,$1.25 avg/ea,cub
1859,03-3-23,produce,Produce Red Jumbo Cherries . PoundOpen ,$19.98 avg/ea,cub
1860,03-3-23,produce,Fresh Blood Orange   ,$1.29,cub
1861,03-3-23,produce,Produce Minneola Tangelos   ,$1.29,cub
1862,03-3-23,produce,Produce Apple Fuji . PoundOpen ,$1.50 avg/ea,cub
1863,03-3-23,produce,Fresh Organic Raspberries . PoundOpen ,$5.99,cub
1864,03-3-23,produce,Quick and Easy Cantaloupe Chunks  ,$6.49,cub
1865,03-3-23,produce,Produce Bananas Organic . PoundOpen ,$0.40 avg/ea,cub
1866,03-3-23,produce,Produce Apple Braeburn . PoundOpen ,$1.50 avg/ea,cub
1867,03-3-23,produce,Quick and Easy Pineapple Chunks Fresh Cut  Ounce   ,$4.99,cub
1868,03-3-23,produce,Produce Sumo Mandarins  Pound Bag   ,$6.99,cub
1869,03-3-23,produce,Produce Strawberries  ,$5.99,cub
1870,03-3-23,produce,Produce Pear D'Anjou . PoundOpen ,$1.20 avg/ea,cub
1871,03-3-23,produce,Fresh Honeybear Cubbie Fuji  PoundOpen ,$6.99,cub
1872,03-3-23,produce,Produce Apple Gala . PoundOpen ,$1.50 avg/ea,cub
1873,03-3-23,produce,Fresh Honeybear Cubbies Pink Lady  PoundOpen ,$6.99,cub
1874,03-3-23,produce,Fresh Honeybear Cubbie Gala Apples  PoundOpen ,$6.99,cub
1875,03-3-23,produce,Driscoll's Strawberries Organic  ,$7.99,cub
1876,03-3-23,produce,Ultimate Lemons Lemons  PoundOpen ,$5.49,cub
1877,03-3-23,produce,Produce Black Seedless Grapes  PoundOpen ,$1.99 avg/ea,cub
1878,03-3-23,produce,Produce Apple Red Delicious . PoundOpen ,$1.25 avg/ea,cub
1879,03-3-23,produce,Produce Pineapple   ,$3.99,cub
1880,03-3-23,produce,Quick & Easy Five Fruit Blend  ,$7.49,cub
1881,03-3-23,produce,Quick & Easy Watermelon Spears   ,$6.49,cub
1882,03-3-23,produce,Wonderful Lemons Seedless  PoundOpen ,$3.99,cub
1883,03-3-23,produce,Produce Blueberries  ,$3.00,cub
1884,03-3-23,produce,Quick & Easy Small Cut Mango   ,$5.99,cub
1885,03-3-23,produce,Driscoll's  Sweetest Batch Blackberries  ,$6.99,cub
1886,03-3-23,produce,Produce Apple Sugarbee . PoundOpen ,$2.00 avg/ea,cub
1887,03-3-23,produce,Quick and Easy Deluxe Bowl . PoundOpen ,$21.99,cub
1888,03-3-23,produce,Produce Pear Red D'Anjou . PoundOpen ,$0.75 avg/ea,cub
1889,03-3-23,produce,Produce Apple Golden Delicious . PoundOpen ,$1.50 avg/ea,cub
1890,03-3-23,produce,Fresh Organic Honeycrisp Apples . PoundOpen ,$2.25 avg/ea,cub
1891,03-3-23,produce,Produce Nectarine . PoundOpen ,$1.20 avg/ea,cub
1892,03-3-23,produce,Quick & Easy Deluxe Fruit Bowl   ,$13.99,cub
1893,03-3-23,produce,Fresh Honeybear Cubbie Braeburn  PoundOpen ,$6.99,cub
1894,03-3-23,produce,Produce Seedless Watermelon   ,$9.99,cub
1895,03-3-23,produce,Fresh Honey Bear Cubbie Granny Smith Apples  PoundOpen ,$7.99,cub
1896,03-3-23,produce,Del Monte Red Grapefruit  ,$12.99,cub
1897,03-3-23,produce,Produce Pear Bosc . PoundOpen ,$1.00 avg/ea,cub
1898,03-3-23,produce,Produce Lemon Organic   ,$1.29,cub
1899,03-3-23,produce,Quick and Easy Pineapple Chunks Fresh Cut  Ounce   ,$10.99,cub
1900,03-3-23,produce,Quick & Easy Fresh Cut Fruit Strawberry Kiwi Blueberry Medium   ,$8.49,cub
1901,03-3-23,produce,Produce Mini Seedless Watermelon   ,$5.99,cub
1902,03-3-23,produce,Quick and Easy Cantaloupe  ,$10.99,cub
1903,03-3-23,produce,"Rubyfrost Apples .""  PoundOpen ",$5.99,cub
1904,03-3-23,produce,Produce Black Plum Large . PoundOpen ,$1.00 avg/ea,cub
1905,03-3-23,produce,Produce Yellow Peach . PoundOpen ,$2.00 avg/ea,cub
1906,03-3-23,produce,Del Monte Pineapple Pinkglow   ,$12.99,cub
1907,03-3-23,produce,Natural Delights Dates Fresh Whole Medjool  PoundOpen ,$8.99,cub
1908,03-3-23,produce,Fresh Red Grapefruit   ,$2.99,cub
1909,03-3-23,produce,Fresh Organic Blueberries  ,$3.00,cub
1910,03-3-23,produce,Del Monte Red Grapefruit . ,$2.19,cub
1911,03-3-23,produce,Fresh Honeybear Cubbie Red Delicious  PoundOpen ,$6.99,cub
1912,03-3-23,produce,Produce Blackberries  ,$3.99,cub
1913,03-3-23,produce,Del Monte Red Grapefruit  ,$2.19,cub
1914,03-3-23,produce,Fresh Bagged Koru Apples  PoundOpen ,$5.99,cub
1915,03-3-23,produce,Fresh Organic Naval Orange   ,$1.50,cub
1916,03-3-23,produce,Produce Raspberries  ,$3.00,cub
1917,03-3-23,produce,Del Monte Red Grapefruit in Extra Light Syrup  ,$12.99,cub
1918,03-3-23,produce,Fresh Organic Honeycrisp Apples  PoundOpen ,$8.99,cub
1919,03-3-23,produce,Quick and Easy Pineapple Cored  ,$6.99,cub
1920,03-3-23,produce,Produce Clementines Bagged  PoundOpen ,$3.99,cub
1921,03-3-23,produce,Del Monte Red Grapefruit in Extra Light Syrup  ,$4.99,cub
1922,03-3-23,produce,Fresh Produce Strawberries  ,$4.99,cub
1923,03-3-23,produce,Produce Dragon Fruit   ,$8.99,cub
1924,03-3-23,produce,Quick and Easy Chunk Melon Mix  ,$7.49,cub
1925,03-3-23,produce,Del Monte Red Grapefruit in Water . ,$4.99,cub
1926,03-3-23,produce,Fresh Produce Blueberry Pint  PintOpen ,$3.00,cub
1927,03-3-23,produce,Fresh Blackberries  ,$6.99,cub
1928,03-3-23,produce,Produce Pomegranates   ,$3.99,cub
1929,03-3-23,produce,Quick and Easy Pineapple Spears  ,$6.49,cub
1930,03-3-23,produce,Plums Yellow . PoundOpen ,$1.08 avg/ea,cub
1931,03-3-23,produce,Produce Plaintain Macho . PoundOpen ,$0.67 avg/ea,cub
1932,03-3-23,produce,POM Pomegranate   ,$3.99,cub
1933,03-3-23,produce,Produce Bagged Blood Oranges  PoundOpen ,$5.99,cub
1934,03-3-23,produce,Fresh Produce Cantaloupe   ,$4.99,cub
1935,03-3-23,produce,Dippin Stix Sweet Apples & Caramel . ,$1.79,cub
1936,03-3-23,produce,Natural Delights Medjool Dates Fresh Organic Whole  ,$9.99,cub
1937,03-3-23,produce,Melissa's Meyer Lemons  PoundOpen ,$6.99,cub
1938,03-3-23,produce,Sol Watermelon   ,$5.99,cub
1939,03-3-23,produce,Produce Apple Granny Smith Organic . PoundOpen ,$1.25 avg/ea,cub
1940,03-3-23,produce,Quick and Easy Pineapple Rings  ,$6.99,cub
1941,03-3-23,produce,Produce Honeydew Melon   ,$5.49,cub
1942,03-3-23,produce,Pom Poms Wonderful Pomegranate Fresh Arils  ,$5.99,cub
1943,03-3-23,produce,Fresh Black Seedless Grapes  PoundOpen ,$1.99/lb,cub
1944,03-3-23,produce,Produce Pear Red Bartlett . PoundOpen ,$0.87 avg/ea,cub
1945,03-3-23,produce,Dippin Stix Sliced Apples & Caramel . ,$1.79,cub
1946,03-3-23,produce,Del Monte Mango Chunks in Extra Light Syrup  ,$2.19,cub
1947,03-3-23,produce,Oranges    ,$1.29,cub
1948,03-3-23,produce,Del Monte Peaches Cling Extra Light Syrup Sliced  ,$4.99,cub
1949,03-3-23,produce,Del Monte Citrus Salad  ,$12.99,cub
1950,03-3-23,produce,Produce Plum Red . PoundOpen ,$1.25 avg/ea,cub
1951,03-3-23,produce,Dulcinea Watermelon Mini Seedless   ,$5.99,cub
1952,03-3-23,produce,Produce Bagged Cara Cara Oranges  PoundOpen ,$5.99,cub
1953,03-3-23,produce,Quick and Easy  fruit blend spears  ,$6.49,cub
1954,03-3-23,produce,Dippin Stix Sliced Apples & Peanut Butter . ,$1.79,cub
1955,03-3-23,produce,Produce Star Fruit   ,$4.99,cub
1956,03-3-23,produce,Fresh Kiwi Clam  PoundOpen ,$8.99,cub
1957,03-3-23,produce,POM Wonderful Fresh Arils Pomegranate  ,$9.99,cub
1958,03-3-23,produce,Produce Strawberries  PoundOpen ,$8.99,cub
1959,03-3-23,produce,Produce Seeded Watermelon   ,$9.99,cub
1960,03-3-23,produce,Del Monte Fruit Naturals Bartlett Pears  ,$2.19,cub
1961,03-3-23,produce,Del Monte Peach Chunks  ,$2.19,cub
1962,03-3-23,produce,Tangelo    ,$0.99,cub
1963,03-3-23,produce,Del Monte  SunFresh Mango Chunks In Extra Light Syrup  ,$12.99,cub
1964,03-3-23,produce,Grapefruit Organically Grown Red / Pink   ,$3.49,cub
1965,03-3-23,produce,Del Monte Mandarin Oranges  ,$4.99,cub
1966,03-3-23,produce,Fresh Key Limes  PoundOpen ,$4.99,cub
1967,03-3-23,produce,Del Monte Mango in Extra Light Syrup  ,$4.99,cub
1968,03-3-23,produce,Bard Valley Natural Delights Coconut Medjool Date Rolls  ,$9.99,cub
1969,03-3-23,produce,Quick & Easy Strawberry Parfait Yogurt  ,$4.99,cub
1970,03-3-23,produce,Produce Jaffa Orri   ,$0.99,cub
1971,03-3-23,produce,Produce Apple Haralson  PoundOpen ,$2.49 avg/ea,cub
1972,03-3-23,produce,Quick & Easy Mango Sliced  ,$10.99,cub
1973,03-3-23,produce,Dippin Stix Apple & Fruit Dip Sliced . ,$1.79,cub
1974,03-3-23,produce,Cub Apples Pazazz Tote Bag . PoundOpen ,$10.47 avg/ea,cub
1975,03-3-23,produce,Produce Pear Cactus   ,$3.49,cub
1976,03-3-23,produce,Fresh Peach Yellow Flesh Small  PoundOpen ,$3.99 avg/ea,cub
1977,03-3-23,produce,Del Monte Citrus Salad Extra Light Syrup  ,$4.99,cub
1978,03-3-23,produce,Fresh Navel Oranges Bag  PoundOpen ,$7.99,cub
1979,03-3-23,produce,Del Monte Cherry Mixed Fruit  ,$2.19,cub
1980,03-3-23,produce,Del Monte Peach Chunks Yellow Cling No Sugar Added . ,$2.19,cub
1981,03-3-23,produce,Red Delicious Apples . PoundOpen ,$0.76 avg/ea,cub
1982,03-3-23,produce,Concord  Fresh Success Apple Crisp Mix . ,$2.99,cub
1983,03-3-23,produce,Produce Papaya Golden   ,$5.99,cub
1984,03-3-23,produce,Fresh Red Grapes Seeded  PoundOpen ,$3.49 avg/ea,cub
1985,03-3-23,produce,Mcintosh Apples . PoundOpen ,$1.25 avg/ea,cub
1986,03-3-23,produce,Oranges Navel   ,$1.29,cub
1987,03-3-23,produce,Driscoll's Raspberries  ,$7.99,cub
1988,03-3-23,produce,Wild Harvest Apples Granny Smith Organic  ,$7.99,cub
1989,03-3-23,produce,Produce Cantaloupe Small   ,$3.49,cub
1990,03-3-23,produce,Quick and Easy Watermelon Spears  ,$7.49,cub
1991,03-3-23,produce,Fresh Blueberries  ,$3.99,cub
1992,03-3-23,produce,Grapefruit White   ,$2.99,cub
1993,03-3-23,produce,Diamond Blues Blueberries Fresh Cultivated  PintOpen ,$3.00,cub
1994,03-3-23,produce,Western Gold Mandarins Murcott  PoundOpen ,$5.99,cub
1995,03-3-23,produce,Del Monte Citrus Salad Grapefruit & Oranges  ,$2.19,cub
1996,03-3-23,produce,Del Monte Pineapple Chunks In % Juice  ,$2.19,cub
1997,03-3-23,produce,Produce Pear Red . PoundOpen ,$0.62 avg/ea,cub
1998,03-3-23,produce,Produce Organic Grapefruit   ,$3.49,cub
1999,03-3-23,produce,Fresh Asian Brown Pears   ,$2.99,cub
2000,03-3-23,produce,Fresh Black Diamond Melons   ,$8.99,cub
2001,03-3-23,produce,Produce Packham Pear  PoundOpen ,$1.99 avg/ea,cub
2002,03-3-23,produce,Dippin Stix Sweet Apples & Chocolate Caramels . ,$1.79,cub
2003,03-3-23,produce,Produce Orange Organic Navel   ,$1.50,cub
2004,03-3-23,produce,Produce Apples Gala  ,$1.50 avg/ea,cub
2005,03-3-23,produce,Quick & Easy Seeded / Cut Watermelon . PoundOpen ,$6.97 avg/ea,cub
2006,03-3-23,produce,Asian / Nashi Pears   ,$0.99,cub
2007,03-3-23,produce,Earthbound Farm Lemons - Organic  PoundOpen ,$5.99,cub
2008,03-3-23,produce,Patagonia Orchards Limes Certified Organic  ,$5.49,cub
2009,03-3-23,produce,Persian Melon   ,$4.99,cub
2010,03-3-23,produce,Fresh Produce Jackfruit  PoundOpen ,$17.94 avg/ea,cub
2011,03-3-23,produce,Produce Apple . PoundOpen ,$0.93 avg/ea,cub
2012,03-3-23,produce,Del Monte Mandarin Oranges in Extra Light Syrup  ,$2.19,cub
2013,03-3-23,produce,Quick & Easy Seedless / Cut Watermelon . PoundOpen ,$6.97 avg/ea,cub
2014,03-3-23,produce,Yellow Bananas . PoundOpen ,$0.30 avg/ea,cub
2015,03-3-23,produce,Cuties Clementines  PoundOpen ,$9.99,cub
2016,03-3-23,produce,Fresh Kiwanos   ,$9.99,cub
2017,03-3-23,produce,Produce Apricot . PoundOpen ,$1.25 avg/ea,cub
2018,03-3-23,produce,Nectarines White Flesh Flat . PoundOpen ,$1.52 avg/ea,cub
2019,03-3-23,produce,Sunkist Oranges Cara Cara  PoundOpen ,$5.99,cub
2020,03-3-23,produce,I Love Pomegranates Pomegranate Arils . ,$5.99,cub
2021,03-3-23,produce,Produce Bagged Limes  PoundOpen ,$6.99,cub
2022,03-3-23,produce,Kiwi Ripe & Ready Kiwi Clamshell  ,$4.99,cub
2023,03-3-23,produce,Simply Concord Caramel Apple Wrap The Original . ,$4.99,cub
2024,03-3-23,produce,Gala Apples . PoundOpen ,$0.93 avg/ea,cub
2025,03-3-23,produce,Red Delicious Apples . PoundOpen ,$0.57 avg/ea,cub
2026,03-3-23,produce,Produce Clementines Bagged  PoundOpen ,$3.99,cub
2027,03-3-23,produce,Produce White Peach . PoundOpen ,$1.60 avg/ea,cub
2028,03-3-23,produce,Produce Pear Asian/Nashi   ,$2.49,cub
2029,03-3-23,produce,Rome Apples . PoundOpen ,$0.31 avg/ea,cub
2030,03-3-23,produce,Earthbound Farm Organic Valencia Oranges  PoundOpen ,$9.99,cub
2031,03-3-23,produce,Fresh Produce Burro Banana  PoundOpen ,$0.99 avg/ea,cub
2032,03-3-23,produce,Simply Organic Yellow Nectarines Bagged  PoundOpen ,$6.99,cub
2033,03-3-23,produce,Bolthouse Farms Carrots Premium Sweet Petites  ,$2.49,cub
2034,03-3-23,produce,Bolthouse Farms Carrots Premium Sweet Petites  ,$2.49,cub
2035,03-3-23,produce,Bolthouse Farms Carrots Premium Sweet Petites  ,$2.49,cub
2036,03-3-23,produce,Dole Romaine Hearts   ,$3.49,cub
2037,03-3-23,produce,Earth Harvest Med Polished Carrots  PoundOpen ,$2.49,cub
2038,03-3-23,produce,Earth Harvest Med Polished Carrots  PoundOpen ,$2.49,cub
2039,03-3-23,produce,Earth Harvest Med Polished Carrots  PoundOpen ,$2.49,cub
2040,03-3-23,produce,Eat Smart Green Beans  ,$4.99,cub
2041,03-3-23,produce,Fresh Asparagus  PoundOpen ,$5.99 avg/ea,cub
2042,03-3-23,produce,Fresh Bulk Garlic . PoundOpen ,$0.90 avg/ea,cub
2043,03-3-23,produce,Fresh Bulk Garlic . PoundOpen ,$0.90 avg/ea,cub
2044,03-3-23,produce,Fresh Bulk Garlic . PoundOpen ,$0.90 avg/ea,cub
2045,03-3-23,produce,Fresh Celery Bunch   ,$2.49,cub
2046,03-3-23,produce,Fresh Large Tomatoes . PoundOpen ,$1.60 avg/ea,cub
2047,03-3-23,produce,Fresh Mini Peeled Carrots  PoundOpen ,$1.99,cub
2048,03-3-23,produce,Fresh Mini Peeled Carrots  PoundOpen ,$3.49,cub
2049,03-3-23,produce,Fresh Mini Peeled Carrots  PoundOpen ,$3.49,cub
2050,03-3-23,produce,Fresh Mini Peeled Carrots  PoundOpen ,$3.49,cub
2051,03-3-23,produce,Fresh On the Vine Red Tomatoes . PoundOpen ,$3.99/lb,cub
2052,03-3-23,produce,Green Giant Mushrooms Baby Bella  ,$2.99,cub
2053,03-3-23,produce,Green Giant Mushrooms Whole  ,$2.50,cub
2054,03-3-23,produce,Green Giant Mushrooms Whole  ,$2.50,cub
2055,03-3-23,produce,Green Giant Mushrooms Whole  ,$2.50,cub
2056,03-3-23,produce,Mann's Sugar Snap Peas Stringless  ,$4.99,cub
2057,03-3-23,produce,NatureSweet Salad Tomatoes Heavenly  ,$4.99,cub
2058,03-3-23,produce,NatureSweet Salad Tomatoes Heavenly  ,$4.99,cub
2059,03-3-23,produce,NatureSweet Salad Tomatoes Heavenly  ,$4.99,cub
2060,03-3-23,produce,Produce Broccoli Bunch   ,$3.99,cub
2061,03-3-23,produce,Produce Cucumber   ,$0.88,cub
2062,03-3-23,produce,Produce English Cucumber   ,$1.99,cub
2063,03-3-23,produce,Produce Green Bell Pepper   ,$1.25,cub
2064,03-3-23,produce,Produce Green Onions   ,$0.88,cub
2065,03-3-23,produce,Produce Red Bell Pepper   ,$1.25,cub
2066,03-3-23,produce,Produce Roma Tomatoes . PoundOpen ,$1.79/lb,cub
2067,03-3-23,produce,Green Giant Green Giant Sliced Mushroom  ,$2.50,cub
2068,03-3-23,produce,Green Giant Mushrooms Baby Bella Sliced  ,$2.99,cub
2069,03-3-23,produce,Fresh Green Beans . PoundOpen ,$3.99/lb,cub
2070,03-3-23,produce,Fresh Green Beans . PoundOpen ,$3.99/lb,cub
2071,03-3-23,produce,Fresh Green Beans . PoundOpen ,$3.99/lb,cub
2072,03-3-23,produce,Produce Orange Bell Pepper   ,$1.25,cub
2073,03-3-23,produce,Fresh Brussel Sprouts . PoundOpen ,$2.99/lb,cub
2074,03-3-23,produce,Produce Cabbage . PoundOpen ,$2.48 avg/ea,cub
2075,03-3-23,produce,Dandy Celery Sticks . PoundOpen ,$3.99,cub
2076,03-3-23,produce,Produce Yellow Bell Pepper   ,$1.25,cub
2077,03-3-23,produce,Produce Grape Tomatoes  PintOpen ,$2.99,cub
2078,03-3-23,produce,Dole Spinach  ,$3.99,cub
2079,03-3-23,produce,Wild Harvest Romaine Hearts Organic   ,$3.99,cub
2080,03-3-23,produce,Bolthouse Farms Cooking Carrots French-Cut Premium  ,$1.99,cub
2081,03-3-23,produce,Mann's Broccoli Wokly  ,$3.99,cub
2082,03-3-23,produce,Fresh Jalapeno Peppers . PoundOpen ,$0.30 avg/ea,cub
2083,03-3-23,produce,Fresh Ginger Root . PoundOpen ,$3.99/lb,cub
2084,03-3-23,produce,Mighty Minis Mini Peppers Sweet  PoundOpen ,$5.99,cub
2085,03-3-23,produce,Green Giant Mushrooms Petite  ,$2.49,cub
2086,03-3-23,produce,Fresh Red Radish Bunch   ,$1.49,cub
2087,03-3-23,produce,Sunset Tomatoes Gourmet Medley  ,$5.49,cub
2088,03-3-23,produce,Revol Greens Butter Leaf Living   ,$4.99,cub
2089,03-3-23,produce,Taylor Farms  Good Times Vegetable Tray  ,$14.99,cub
2090,03-3-23,produce,Produce Celery Organic   ,$4.49,cub
2091,03-3-23,produce,Bushel Boy Red Grape Tomatoes  PintOpen ,$4.99,cub
2092,03-3-23,produce,Fresh Lettuce Romaine   ,$2.99,cub
2093,03-3-23,produce,Fresh Kale  PoundOpen ,$1.99,cub
2094,03-3-23,produce,Bushel Boy Cherry Tomatoes  PintOpen ,$4.99,cub
2095,03-3-23,produce,Fresh Radishes . PoundOpen ,$2.49,cub
2096,03-3-23,produce,Produce Green Top Carrots Bunch   ,$2.49,cub
2097,03-3-23,produce,Fresh Poblano Peppers . PoundOpen ,$1.75 avg/ea,cub
2098,03-3-23,produce,Fresh Produce Leeks . PoundOpen ,$2.50 avg/ea,cub
2099,03-3-23,produce,Spice World Garlic Minced  ,$4.49,cub
2100,03-3-23,produce,Fresh Snow Pea Pods . PoundOpen ,$4.99/lb,cub
2101,03-3-23,produce,Mann's Family Favorites Broccoli and Cauliflower  ,$3.99,cub
2102,03-3-23,produce,Bolthouse Farms Carrot Chips  PoundOpen ,$2.49,cub
2103,03-3-23,produce,Sunset Sprinkle Tomatoes . ,$2.99,cub
2104,03-3-23,produce,Robinson Fresh Kale Greens  ,$3.99,cub
2105,03-3-23,produce,Produce Cauliflower   ,$4.99,cub
2106,03-3-23,produce,Bushel Boy One The Vine Cocktail Tomatoes  ,$3.99,cub
2107,03-3-23,produce,Produce Cabbage Red . PoundOpen ,$3.73 avg/ea,cub
2108,03-3-23,produce,Fresh Spinach Bunch   ,$2.99,cub
2109,03-3-23,produce,Dole Celery Hearts Mild Flavor  ,$3.99,cub
2110,03-3-23,produce,Sunset Tomatoes Organic Campari  ,$5.99,cub
2111,03-3-23,produce,NatureSweet  Cherubs Tomatoes Heavenly Salad . ,$6.99,cub
2112,03-3-23,produce,Fresh Eggplant  PoundOpen ,$1.99,cub
2113,03-3-23,produce,Mann's Broccoli Cole Slaw The Original  ,$3.49,cub
2114,03-3-23,produce,Produce Rutabaga . PoundOpen ,$3.74 avg/ea,cub
2115,03-3-23,produce,Mann's Sugar Snap Peas Stringless  ,$7.99,cub
2116,03-3-23,produce,Fresh Green Leaf Lettuce   ,$2.99,cub
2117,03-3-23,produce,NatureSweet  Glorys Tomatoes Fresh Ingredient  ,$4.99,cub
2118,03-3-23,produce,Bushel Boy On The Vine Cherry Tomatoes  ,$5.99,cub
2119,03-3-23,produce,Fresh Red Bell Peppers   ,$1.25,cub
2120,03-3-23,produce,Fresh Broccolini Ra   ,$3.99,cub
2121,03-3-23,produce,Fresh Collard Greens   ,$1.99,cub
2122,03-3-23,produce,Mann's Vegetable Medley  ,$3.99,cub
2123,03-3-23,produce,Fresh Beets Bunch   ,$4.99,cub
2124,03-3-23,produce,Gourmet Stuffer Mushroom  ,$4.99,cub
