
1,03-3-23,meat,Ambassador Wieners . ,$7.99,cub
2,03-3-23,meat,Ambassador Wieners . ,$7.99,cub
3,03-3-23,meat,Ambassador Wieners . ,$7.99,cub
4,03-3-23,meat,Ambassador Summer Sausage Big N' Meaty  ,$8.99,cub
5,03-3-23,meat,Gilbert's Sausage Chicken Caprese with Basil Mozzarella & Sun-Dried Tomatoes  ,$6.99,cub
6,03-3-23,meat,Gilbert's Sausage Chicken Caprese with Basil Mozzarella & Sun-Dried Tomatoes  ,$6.99,cub
7,03-3-23,meat,Gilbert's Sausage Chicken Caprese with Basil Mozzarella & Sun-Dried Tomatoes  ,$6.99,cub
8,03-3-23,meat,Gilbert's Sausage Chicken Smoked Andouille  ,$6.99,cub
9,03-3-23,meat,Ambassador Wieners  ,$15.99,cub
10,03-3-23,meat,Jimmy Dean Premium Pork Regular Sausage Roll  ,$5.99,cub
11,03-3-23,meat,Jimmy Dean Premium Pork Regular Sausage Roll  ,$5.99,cub
12,03-3-23,meat,Jimmy Dean Premium Pork Regular Sausage Roll  ,$5.99,cub
13,03-3-23,meat,Royale Applewood Smoked Bacon  ,$2.99,cub
14,03-3-23,meat,Johnsonville Breakfast Sausage Links Original Recipe  ,$4.99,cub
15,03-3-23,meat,Hormel Bacon Fully Cooked Original . ,$5.99,cub
16,03-3-23,meat,Cloverdale Bacon Hickory  ,$6.99,cub
17,03-3-23,meat,Cloverdale Bacon Hickory  ,$6.99,cub
18,03-3-23,meat,Cloverdale Bacon Hickory  ,$6.99,cub
19,03-3-23,meat,Cloverdale Bacon Applewood  ,$6.99,cub
20,03-3-23,meat,Hormel Pepperoni Original  ,$5.99,cub
21,03-3-23,meat,Hormel  Black Label Bacon Original  ,$8.99,cub
22,03-3-23,meat,Hormel  Black Label Bacon Original  ,$8.99,cub
23,03-3-23,meat,Hormel  Black Label Bacon Original  ,$8.99,cub
24,03-3-23,meat,Hillshire Farm Lit'l Smokies Smoked Sausage  ,$3.99,cub
25,03-3-23,meat,Farmland Bacon Classic Cut Naturally Hickory Smoked  ,$8.49,cub
26,03-3-23,meat,Farmland Bacon Classic Cut Naturally Hickory Smoked  ,$8.49,cub
27,03-3-23,meat,Farmland Bacon Classic Cut Naturally Hickory Smoked  ,$8.49,cub
28,03-3-23,meat,Oscar Mayer Naturally Hardwood Smoked Bacon  ,$6.99,cub
29,03-3-23,meat,Farmland Bacon Thick Cut  ,$8.49,cub
30,03-3-23,meat,Hillshire Farm Polska Kielbasa Smoked Sausage  ,$4.99,cub
31,03-3-23,meat,Buddig Corned Beef  ,$0.99,cub
32,03-3-23,meat,Hormel  Black Label Bacon Original Microwave Ready  ,$9.99,cub
33,03-3-23,meat,Johnsonville Sausage Beddar with Cheddar Smoked  ,$5.29,cub
34,03-3-23,meat,Wright Bacon Applewood Thick Cut  ,$12.99,cub
35,03-3-23,meat,Johnsonville Breakfast Sausage Vermont Maple Syrup  ,$4.99,cub
36,03-3-23,meat,Hillshire Farm Sausage Beef Smoked  ,$5.49,cub
37,03-3-23,meat,Hormel  Black Label Bacon Thick Cut  ,$8.99,cub
38,03-3-23,meat,Hormel  Black Label Bacon Thick Cut  ,$8.99,cub
39,03-3-23,meat,Hormel  Black Label Bacon Thick Cut  ,$8.99,cub
40,03-3-23,meat,Hillshire Farm Beef Polska Kielbasa Smoked Sausage  ,$5.49,cub
41,03-3-23,meat,Essential Everyday Snack Sticks Beef Sausage  ,$12.99,cub
42,03-3-23,meat,Jimmy Dean Premium Pork Hot Sausage Roll  ,$5.99,cub
43,03-3-23,meat,Oscar Mayer Naturally Hardwood Smoked Thick Cut Bacon  ,$6.99,cub
44,03-3-23,meat,Oscar Mayer  Deli Fresh Oven Roasted Turkey Breast Sliced Lunch Meat for a Low Carb Lifestyle  ,$6.19,cub
45,03-3-23,meat,Hillshire Farm Ultra Thin Deli Sliced Turkey Breast Lunchmeat Oven Roasted Turkey Breast  ,$9.49,cub
46,03-3-23,meat,Buddig Beef  ,$0.99,cub
47,03-3-23,meat,Hillshire Farm  Lit'l Smokies Smoked Sausage  ,$11.99,cub
48,03-3-23,meat,Hillshire Farm Ultra Thin Sliced Honey Ham Deli Meat  ,$9.49,cub
49,03-3-23,meat,Jones Dairy Farm Canadian Bacon Hickory Smoked Center Cut Pork Loin  ,$3.99,cub
50,03-3-23,meat,Lunchables Cracker Stackers Ham and American . ,$3.29,cub
51,03-3-23,meat,Essential Everyday Snack Sticks Turkey Sausage  ,$12.99,cub
52,03-3-23,meat,Schweigert Braunschweiger  ,$3.99,cub
53,03-3-23,meat,Johnsonville Breakfast Sausage Patties Original Recipe  ,$4.99,cub
54,03-3-23,meat,Oscar Mayer Oven Roasted Turkey Breast Sliced Lunch Meat Family Size  ,$10.89,cub
55,03-3-23,meat,Smithfield Bacon Hometown Original Thick Cut  ,$15.99,cub
56,03-3-23,meat,Oscar Mayer Bologna Sliced Lunch Meat  ,$3.49,cub
57,03-3-23,meat,Johnsonville Kielbasa Polish . ,$5.29,cub
58,03-3-23,meat,Smithfield  Prime Fresh Delicatessen Hard Salami Sliced Deli Thin  ,$4.99,cub
59,03-3-23,meat,Johnsonville Smoked Sausage Andouille . ,$5.29,cub
60,03-3-23,meat,Hillshire Farm Ultra Thin Deli Sliced Turkey Breast Lunchmeat Oven Roasted Turkey Breast  ,$5.99,cub
61,03-3-23,meat,Land O Frost Black Forest Ham Old World Style  ,$7.69,cub
62,03-3-23,meat,Oscar Mayer Beef Bologna Sliced Lunch Meat  ,$6.79,cub
63,03-3-23,meat,JIMMY DEAN Fully Cooked Original Pork Sausage Links . ,$5.99,cub
64,03-3-23,meat,Smithfield Turkey Breast Smoked  ,$4.99,cub
65,03-3-23,meat,Hormel  Black Label Bacon Center Cut  ,$8.99,cub
66,03-3-23,meat,Hillshire Farm Ultra Thin Sliced Honey Ham Deli Meat  ,$5.99,cub
67,03-3-23,meat,Jimmy Dean Pork Sausage Patties Fully Cooked Original   ,$5.99,cub
68,03-3-23,meat,Oscar Mayer Classic Uncured Wieners Hot Dogs   ,$3.29,cub
69,03-3-23,meat,Johnsonville Breakfast Sausage Fully Cooked Turkey   ,$5.29,cub
70,03-3-23,meat,Nueske's Bacon Applewood Smoked Sliced  ,$11.49,cub
71,03-3-23,meat,Cloverdale Bacon Uncured Ends & Pieces  ,$8.99,cub
72,03-3-23,meat,Essential Everyday Bacon Hardwood Smoked  ,$6.99,cub
73,03-3-23,meat,Jimmy Dean Pork Sausage Crumbles Original . ,$5.99,cub
74,03-3-23,meat,Smithfield Smoked Ham with Natural Juices  ,$4.99,cub
75,03-3-23,meat,Essential Everyday Snack Sticks Beef Sausage  ,$20.99,cub
76,03-3-23,meat,Oscar Mayer Rotisserie Seasoned Chicken Breast Sliced Lunch Meat for a Low Carb Lifestyle  ,$6.19,cub
77,03-3-23,meat,Hormel Ham Boneless Diced  ,$3.49,cub
78,03-3-23,meat,Old Wisconsin Beef Stick . ,$1.00,cub
79,03-3-23,meat,Hormel Canadian Bacon Thick Slices   ,$5.49,cub
80,03-3-23,meat,Buddig Pastrami  ,$0.99,cub
81,03-3-23,meat,Johnsonville Breakfast Sausage Brown Sugar & Honey Flavor  ,$4.99,cub
82,03-3-23,meat,Oscar Mayer Carving Board Oven Roasted Turkey . ,$6.19,cub
83,03-3-23,meat,Buddig Ham Honey  ,$0.99,cub
84,03-3-23,meat,Oscar Mayer Uncured Bun-Length Wieners Hot Dogs   ,$3.29,cub
85,03-3-23,meat,Hormel Deli Ham Honey  ,$5.79,cub
86,03-3-23,meat,Buddig Turkey  ,$0.99,cub
87,03-3-23,meat,Essential Everyday Snack Sticks Turkey Sausage  ,$20.99,cub
88,03-3-23,meat,Fiorucci Pre-Sliced Prosciutto  ,$6.99,cub
89,03-3-23,meat,Hillshire Farm Ultra Thin Sliced Smoked Ham Deli Meat  ,$5.99,cub
90,03-3-23,meat,Hormel Sausage Pork Mild Spice  ,$4.99,cub
91,03-3-23,meat,Hormel Pepperoni Minis  ,$5.99,cub
92,03-3-23,meat,Culinary Circle Turkey Bacon Premium  ,$5.49,cub
93,03-3-23,meat,Oscar Mayer Honey Smoked Turkey Breast Sliced Lunch Meat  ,$6.19,cub
94,03-3-23,meat,Essential Everyday Bacon Hardwood Smoked Thick Sliced  ,$6.99,cub
95,03-3-23,meat,Land O Frost Turkey Breast Oven Roasted  ,$7.69,cub
96,03-3-23,meat,Oscar Mayer Classic Beef Uncured Franks Hot Dogs   ,$4.29,cub
97,03-3-23,meat,Farmland Bacon Thick Cut  ,$10.49,cub
98,03-3-23,meat,Johnsonville Sausage Smoked . ,$5.29,cub
99,03-3-23,meat,Hormel Bacon Applewood Thick Cut  ,$8.99,cub
100,03-3-23,meat,Hillshire Farm Ultra Thin Roast Beef Lunch Meat  ,$5.99,cub
101,03-3-23,meat,Aidells Andouille Cajun Style  ,$5.99,cub
102,03-3-23,meat,Cub Swedish Potato Sausage  ,$3.74,cub
103,03-3-23,meat,Jones Dairy Farm  Golden Brown Pork Sausage Links Mild Golden Brown   ,$4.49,cub
104,03-3-23,meat,Jimmy Dean Pork Sausage Premium Regular  ,$5.99,cub
105,03-3-23,meat,Land O Frost  Premium Meat Ham Natural Hickory Smoked  ,$7.69,cub
106,03-3-23,meat,Chunk Thuringer  ,$6.99,cub
107,03-3-23,meat,Essential Everyday Ham Honey Ultra Thin Premium Deli  ,$4.99,cub
108,03-3-23,meat,Jimmy Dean Sausage Crumbles Turkey . ,$5.99,cub
109,03-3-23,meat,Smithfield Bacon Thick Cut  ,$5.99,cub
110,03-3-23,meat,Essential Everyday Turkey Breast Oven Roasted Ultra Thin Premium Deli  ,$4.99,cub
111,03-3-23,meat,Oscar Mayer  Deli Fresh Ham Uncured Smoked  ,$6.19,cub
112,03-3-23,meat,Buddig Black Forest Turkey  ,$0.99,cub
113,03-3-23,meat,Essential Everyday Pepperoni Original  ,$3.59,cub
114,03-3-23,meat,Margherita Pepperoni Sliced  ,$6.99,cub
115,03-3-23,meat,Fiorucci  Panino Hard Salami Antipasti  ,$7.99,cub
116,03-3-23,meat,Nathan's  Famous Franks Beef Skinless Bun Lengh   ,$4.99,cub
117,03-3-23,meat,Buddig Ham  ,$0.99,cub
118,03-3-23,meat,Aidells Chicken Sausage Chicken & Apple Smoked  ,$5.99,cub
119,03-3-23,meat,Smithfield Ham Cubed  ,$3.99,cub
120,03-3-23,meat,Hillshire Farm Sausage Smoked  ,$4.99,cub
121,03-3-23,meat,Oscar Mayer  Deli Fresh Ham Uncured Honey  ,$6.19,cub
122,03-3-23,meat,Hormel Bacon Uncured Fully Cooked . ,$5.99,cub
123,03-3-23,meat,Farmland Bacon Hickory Smoked Classic Cut  ,$9.49,cub
124,03-3-23,meat,Old Wisconsin Snack Bites Turkey Sausage  ,$7.29,cub
125,03-3-23,meat,Hillshire Farm Smoked Sausage Andouille Cajun Style  ,$4.99,cub
126,03-3-23,meat,Jimmy Dean Sausage Patties Original Value Pack .  ,$7.99,cub
127,03-3-23,meat,Hormel  Natural Choice Bacon Original Uncured  ,$8.99,cub
128,03-3-23,meat,Oscar Mayer  Deli Fresh Slow Roasted Roast Beef Sliced Lunch Meat  ,$6.19,cub
129,03-3-23,meat,Jennie O Turkey Sausage Lean  ,$4.99,cub
130,03-3-23,meat,Fiorucci  Panino Prosciutto Antipasti  ,$7.99,cub
131,03-3-23,meat,Fiorucci Pancetta Antipasti Diced  ,$6.99,cub
132,03-3-23,meat,Smithfield Ham Black Forest  ,$4.99,cub
133,03-3-23,meat,Hillshire Farm Smoked Sausage Turkey  ,$4.99,cub
134,03-3-23,meat,John Morrell Braunschweiger  ,$4.99,cub
135,03-3-23,meat,Essential Everyday Pepperoni Turkey  ,$4.19,cub
136,03-3-23,meat,Hormel  Black Label Bacon Original Thick Cut  ,$12.49,cub
137,03-3-23,meat,Hillshire Farm  Beef Lit'l Smokies Sausage Beef Smoked  ,$3.99,cub
138,03-3-23,meat,Hormel Pepperoni Uncured  ,$5.99,cub
139,03-3-23,meat,Oscar Mayer Bun-Length Angus Beef Uncured Beef Franks Hot Dogs   ,$4.29,cub
140,03-3-23,meat,Jimmy Dean Sausage Links Original Value Pack   ,$7.99,cub
141,03-3-23,meat,Old Wisconsin Snack Sticks Turkey Sausage  ,$7.29,cub
142,03-3-23,meat,Ball Park Beef Hot Dogs  ,$8.99,cub
143,03-3-23,meat,Hormel  Natural Choice Deli Turkey Oven Roasted Fully Cooked/Sliced  ,$5.79,cub
144,03-3-23,meat,Aidells Smoked Chicken Sausage Italian Style  ,$5.99,cub
145,03-3-23,meat,Nathan's Franks Beef Skinless   ,$4.99,cub
146,03-3-23,meat,Banquet Sausage Links Original   ,$2.59,cub
147,03-3-23,meat,Essential Everyday Snack Sticks Turkey Sausage Honey Brown Sugar  ,$12.99,cub
148,03-3-23,meat,Margherita Salami Hard  ,$11.99,cub
149,03-3-23,meat,Nathan's  Famous Franks Beef Restaurant Style Jumbo Dinner Size  ,$4.99,cub
150,03-3-23,meat,Ball Park Beef Franks  ,$5.49,cub
151,03-3-23,meat,Jimmy Dean Simple Scrambles Sausage Breakfast Cup . ,$3.99,cub
152,03-3-23,meat,Smithfield Ham Diced  ,$3.99,cub
153,03-3-23,meat,Daniele Prosciutto President's  ,$5.99,cub
154,03-3-23,meat,Hillshire Farm Turkey Polska Kielbasa Smoked Sausage Rope  ,$4.99,cub
155,03-3-23,meat,Johnsonville Summer Sausage Original  ,$5.79,cub
156,03-3-23,meat,Oscar Mayer Original Center Cut Bacon for a Low Carb Lifestyle  ,$6.99,cub
157,03-3-23,meat,Schweigert Summer Sausage Beef  ,$7.99,cub
158,03-3-23,meat,Smithfield Bacon Thick Cut  ,$5.99,cub
159,03-3-23,meat,Farmland Bacon Extra Thick Cut  ,$8.49,cub
160,03-3-23,meat,Essential Everyday Polska Kielbasa  ,$4.69,cub
161,03-3-23,meat,Oscar Mayer Hard Salami Sliced Lunch Meat  ,$6.29,cub
162,03-3-23,meat,Kretschmar Beef Summer Sausage  PoundOpen ,$9.99,cub
163,03-3-23,meat,Johnsonville Polish Kielbasa   ,$5.29,cub
164,03-3-23,meat,Hillshire Farm Ultra Thin Sliced Pastrami Deli Meat  ,$5.99,cub
165,03-3-23,meat,Hormel Bacon Thick Cut Pecanwood  ,$12.49,cub
166,03-3-23,meat,Fiorucci Pepperoni Uncured  ,$6.99,cub
167,03-3-23,meat,John Morrell Franks  ,$1.99,cub
168,03-3-23,meat,Ambassador Beef Wieners Natural Casing . ,$7.99,cub
169,03-3-23,meat,Manea's Meat Sticks Jalapeno Cheddar  ,$5.99,cub
170,03-3-23,meat,Smithfield Bacon Hometown Original  ,$5.99,cub
171,03-3-23,meat,Schweigert Beef Summer Sausage  ,$4.49,cub
172,03-3-23,meat,Hillshire Farm Ultra Thin Sliced Brown Sugar Ham Deli Meat  ,$5.99,cub
173,03-3-23,meat,Johnsonville Bratwurst Beef Brats Smoked  ,$5.99,cub
174,03-3-23,meat,Johnsonville Pork Breakfast Sausage Patties Original  Patties  ,$7.99,cub
175,03-3-23,meat,Hormel  Black Label Bacon Maple  ,$8.99,cub
176,03-3-23,meat,Essential Everyday Salami Hard Uncured Sliced Premium Deli  ,$4.99,cub
177,03-3-23,meat,Oscar Mayer Smoked Turkey Breast Sliced Lunch Meat  ,$6.19,cub
178,03-3-23,meat,Oscar Mayer Cotto Salami Sliced Lunch Meat  ,$3.49,cub
179,03-3-23,meat,Farmland Original Pork Sausage Links   ,$2.50,cub
180,03-3-23,meat,Cloverdale Foods Company Bacon Applewood Extra Thick Cut  ,$22.99,cub
181,03-3-23,meat,Johnsonville Stadium Brats  ,$5.29,cub
182,03-3-23,meat,Jimmy Dean  Simple Scrambles Meat Lovers . ,$3.99,cub
183,03-3-23,meat,Ball Park Beef Franks Bun Size  ,$5.49,cub
184,03-3-23,meat,Manea's Meat Sticks Cheddar  ,$5.99,cub
185,03-3-23,meat,Oscar Mayer Bologna Sliced Lunch Meat  ,$2.49,cub
186,03-3-23,meat,Johnsonville Smoked Sausage Jalapeno Cheddar  ,$5.29,cub
187,03-3-23,meat,Johnsonville Smoked Brats  ,$5.29,cub
188,03-3-23,meat,Johnsonville Polish Kielbasa Turkey Rope  ,$5.29,cub
189,03-3-23,meat,Cloverdale Summer Sausage Original Tangy  ,$13.49,cub
190,03-3-23,meat,Cub Sausage Smoked Country Brand  ,$3.74,cub
191,03-3-23,meat,Smithfield Pork Sausage Patties Hometown Original . ,$7.49,cub
192,03-3-23,meat,Hebrew National Beef Franks . ,$5.99,cub
193,03-3-23,meat,Schweigert Summer Sausage  ,$7.99,cub
194,03-3-23,meat,Busseto Salami Italian Dry Black Pepper Coated  ,$7.99,cub
195,03-3-23,meat,Jones Dairy Farm  Golden Brown Sausage Links Turkey   ,$4.49,cub
196,03-3-23,meat,Banquet Sausage Links Vermont Maple   ,$2.59,cub
197,03-3-23,meat,Johnsonville Summer Sausage Beef  ,$5.99,cub
198,03-3-23,meat,Oscar Mayer Lean Oven Roasted White Turkey Sliced Lunch Meat  ,$4.39,cub
199,03-3-23,meat,Gilbert's Sausage Chicken Smoked Andouille  ,$6.99,cub
200,03-3-23,meat,Oscar Mayer Braunschweiger A Liver Sausage  ,$3.99,cub
201,03-3-23,meat,Oscar Mayer  Deli Fresh Ham Uncured Honey Family Pack  ,$10.89,cub
202,03-3-23,meat,Schweigert Wieners Old Fashioned Coarse Ground  ,$6.49,cub
203,03-3-23,meat,Margherita Salami Hard  ,$6.99,cub
204,03-3-23,meat,Land O'Frost Ham Black Forest Uncured  ,$5.99,cub
205,03-3-23,meat,Hormel Deli Turkey Smoked Fully Cooked/Sliced  ,$5.79,cub
206,03-3-23,meat,Johnsonville Sausage Smoked Beef  ,$5.29,cub
207,03-3-23,meat,Ball Park Bun Size Classic Hot Dogs Easy Peel Package  ,$4.49,cub
208,03-3-23,meat,Potato Sausage Ring  ,$3.74,cub
209,03-3-23,meat,Oscar Mayer  Deli Fresh Ham Uncured Smoked Family Size  ,$10.89,cub
210,03-3-23,meat,Schweigert Natural Casing Weiners  ,$6.49,cub
211,03-3-23,meat,Hormel Pepperoni Cup n Crisp  ,$5.99,cub
212,03-3-23,meat,Galileo Pepperoni  ,$4.79,cub
213,03-3-23,meat,Oscar Mayer Uncured Cheese Hot Dogs   ,$4.29,cub
214,03-3-23,meat,Old Wisconsin Snack Sticks Beef Sausage  ,$7.29,cub
215,03-3-23,meat,Oscar Mayer Thick Cut Bologna Sliced Lunch Meat  ,$3.49,cub
216,03-3-23,meat,Farmland Bacon Classic Cut  ,$8.49,cub
217,03-3-23,meat,Hillshire Farm Smoked Sausage Wisconsin Cheese . ,$4.99,cub
218,03-3-23,meat,Banquet Sausage Patties Original   ,$2.59,cub
219,03-3-23,meat,Applegate Naturals Sunday Bacon Uncured Hickory Smoked  ,$8.49,cub
220,03-3-23,meat,Oscar Mayer Mesquite Smoked Turkey Breast Sliced Lunch Meat  ,$6.19,cub
221,03-3-23,meat,Old Wisconsin Sausage Premium Summer Beef  ,$6.49,cub
222,03-3-23,meat,Busseto Salami Italian Dry  ,$7.99,cub
223,03-3-23,meat,Culinary Circle Salami Hard  ,$7.99,cub
224,03-3-23,meat,Jimmy Dean Bacon Premium Applewood Smoked  ,$7.99,cub
225,03-3-23,meat,Oscar Mayer Selects Turkey Hot Dogs   ,$5.99,cub
226,03-3-23,meat,Smoked Bratwurst  ,$3.74,cub
227,03-3-23,meat,Aidells Smoked Chicken Sausage Roasted Garlic & Gruyere Cheese  ,$5.99,cub
228,03-3-23,meat,Oscar Mayer Turkey Uncured Franks Hot Dogs   ,$5.99,cub
229,03-3-23,meat,Old Wisconsin Snack Bites Beef Sausage  ,$7.29,cub
230,03-3-23,meat,Oscar Mayer Selects Angus Beef Uncured Beef Franks Hot Dogs   ,$5.69,cub
231,03-3-23,meat,Johnsonville Cooked Bratwurst  ,$5.29,cub
232,03-3-23,meat,Oscar Mayer Beef Cotto Salami Sliced Lunch Meat  ,$6.79,cub
233,03-3-23,meat,Jones Dairy Farm  Golden Brown Pork Sausages Patties Mild   ,$4.49,cub
234,03-3-23,meat,Ambassador Wieners Natural Casing Regular Style . ,$7.99,cub
235,03-3-23,meat,Johnsonville Sausage New Orleans Smoked  ,$5.29,cub
236,03-3-23,meat,Oscar Mayer Jumbo Angus Beef Uncured Beef Franks Hot Dogs   ,$4.29,cub
237,03-3-23,meat,Hebrew National Beef Franks Bun Length  ,$5.99,cub
238,03-3-23,meat,Jimmy Dean  Heat 'n Serve Sausage Patties Turkey Value Pack . ,$7.99,cub
239,03-3-23,meat,Smithfield Turkey Breast Oven Roasted  ,$4.99,cub
240,03-3-23,meat,Swaggerty's Farm  Original  Family Recipe Patties Premium Sausage Seasoned Mild   ,$8.49,cub
241,03-3-23,meat,Ball Park Classic Hot Dogs  ,$4.49,cub
242,03-3-23,meat,Old Wisconsin Sausage Premium Summer Original  ,$6.49,cub
243,03-3-23,meat,Cub Bratwurst Smoked with Cheddar Cheese  ,$3.74,cub
244,03-3-23,meat,Johnsonville Sausage Smoked Beddar With Cheddar . ,$5.29,cub
245,03-3-23,meat,Jimmy Dean  Heat 'n Serve Sausage Links Turkey Value Pack .  ,$7.99,cub
246,03-3-23,meat,Jimmy Dean Simple Scrambles Bacon . oz. . ,$3.99,cub
247,03-3-23,meat,Oscar Mayer Ham & Cheese Meat Loaf with Real Kraft Cheese  ,$4.39,cub
248,03-3-23,meat,Johnsonville Chicken Sausage Andouille Single Sealed Links  ,$5.29,cub
249,03-3-23,meat,Hormel Bacon Thick Cut Naturally Smoked Classic Country Style  ,$8.99,cub
250,03-3-23,meat,Hormel Dried Beef . ,$3.99,cub
251,03-3-23,meat,Schweigert Hot Dogs . ,$4.99,cub
252,03-3-23,meat,LAND O'FROST Turkey Oven Roasted  ,$3.00,cub
253,03-3-23,meat,Essential Everyday Smoked Sausage Cheddar  ,$4.69,cub
254,03-3-23,meat,Jimmy Dean Pork Sausage Hot Premium  ,$5.99,cub
255,03-3-23,meat,Land O'Frost Turkey Breast Applewood Smoked  ,$5.99,cub
256,03-3-23,meat,Hormel Hard Salami Uncured  ,$5.79,cub
257,03-3-23,meat,Essential Everyday Snack Sticks Honey Brown Sugar Turkey Sausage  ,$20.99,cub
258,03-3-23,meat,Buddig Ham Honey Mega Pack  ,$7.99,cub
259,03-3-23,meat,Ambassador Beef Wieners Natural Casing . ,$15.99,cub
260,03-3-23,meat,Oscar Mayer Chopped Ham & Water Product Sliced Lunch Meat  ,$4.39,cub
261,03-3-23,meat,Gilbert's Sausage Chicken Caprese with Basil Mozzarella & Sun-Dried Tomatoes  ,$6.99,cub
262,03-3-23,meat,Regular Beef Sticks  ,$6.99,cub
263,03-3-23,meat,Manea's Meat Sticks Cheddar Ghost Pepper  ,$5.99,cub
264,03-3-23,meat,Aidells Meatballs Chicken Italian Style  ,$5.99,cub
265,03-3-23,meat,Hormel Pepperoni  ,$5.99,cub
266,03-3-23,meat,Buddig Ham Black Forest Mega Pack  ,$7.99,cub
267,03-3-23,meat,Jimmy Dean Bacon Premium Hickory Smoked  ,$7.99,cub
268,03-3-23,meat,Aidells Smoked Chicken Sausage Savory Applewood  ,$5.99,cub
269,03-3-23,meat,Hormel Ham Applewood Smoked  ,$5.79,cub
270,03-3-23,meat,Buddig Turkey Honey Roasted Mega Pack  ,$7.99,cub
271,03-3-23,meat,Fiorucci % Natural Uncured Hard Salami  ,$6.99,cub
272,03-3-23,meat,Essential Everyday Smoked Sausage Andouille  ,$4.69,cub
273,03-3-23,meat,Johnsonville Turkey Sausage Smoked . ,$6.19,cub
274,03-3-23,meat,Jones Dairy Farm Liverwurst Braunschweiger Sliced  ,$3.99,cub
275,03-3-23,meat,Busseto Salami Italian Dry  ,$7.99,cub
276,03-3-23,meat,Hormel Real Bacon Pieces . ,$4.59,cub
277,03-3-23,meat,Ball Park Bun Size Angus Beef Hot Dogs Easy Peel Package  ,$5.49,cub
278,03-3-23,meat,Old Wisconsin  Natural Cut Snack Sticks Turkey Sausage Hardwood-Smoked  ,$7.29,cub
279,03-3-23,meat,Kretschmar Beef & Garlic Summer Sausage  PoundOpen ,$9.99,cub
280,03-3-23,meat,Aidells Sausage Smoked Chicken Pineapple & Bacon  ,$5.99,cub
281,03-3-23,meat,Zatarain's Andouille Smoked Sausage  ,$5.39,cub
282,03-3-23,meat,Old Wisconsin Snack Sticks Beef Sausage  ,$12.49,cub
283,03-3-23,meat,Banquet  Brown 'N Serve Sausage Links Beef   ,$2.59,cub
284,03-3-23,meat,Johnsonville Turkey Breakfast Sausage Patties  Patties  ,$7.99,cub
285,03-3-23,meat,Fiorucci All Natural Genoa Salami Sliced  ,$6.99,cub
286,03-3-23,meat,Schweigert Natural Casing Wieners  ,$11.99,cub
287,03-3-23,meat,Hormel Pepperoni  ,$5.99,cub
288,03-3-23,meat,Nathan's Beef Franks Uncured  ,$4.99,cub
289,03-3-23,meat,Oscar Mayer Bologna Sliced Lunch Meat  ,$3.49,cub
290,03-3-23,meat,Kiolbassa Sausage Polish Smoked  ,$7.99,cub
291,03-3-23,meat,Culinary Circle Jamon Serrano Sliced  ,$5.49,cub
292,03-3-23,meat,Oscar Mayer Lean Honey Ham Sliced Lunch Meat with Added Water  ,$5.49,cub
293,03-3-23,meat,Kiolbassa Sausage Beef Smoked  ,$7.99,cub
294,03-3-23,meat,Schweigert Ring Bologna  ,$5.99,cub
295,03-3-23,meat,Hormel Pepperoni Minis Turkey  ,$5.99,cub
296,03-3-23,meat,Manea's Meat Sticks Teriyaki  ,$5.99,cub
297,03-3-23,meat,Del Duca Sopressata Chub  ,$6.99,cub
298,03-3-23,meat,Jennie-O Turkey Franks with Natural Smoke Flavoring Jumbo  ,$2.99,cub
299,03-3-23,meat,Smithfield Breakfast Sausage Hometown Original   ,$4.99,cub
300,03-3-23,meat,Fiorucci Capocollo Hot  ,$6.99,cub
301,03-3-23,meat,Klements Snack Sticks Beef  ,$5.79,cub
302,03-3-23,meat,Thick Sliced Bacon  ,$10.99,cub
303,03-3-23,meat,Old Wisconsin Snack Sticks Turkey Sausage  ,$12.49,cub
304,03-3-23,meat,Eckrich Polska Kielbasa Skinless  ,$4.99,cub
305,03-3-23,meat,Smithfield Breakfast Sausage Premium Pork Hometown Original   ,$4.99,cub
306,03-3-23,meat,Old Wisconsin  Natural Cut Snack Sticks Hardwood-Smoked Beef Sausage  ,$7.29,cub
307,03-3-23,meat,Essential Everyday Sausage Smoked  ,$4.69,cub
308,03-3-23,meat,Oscar Mayer Selects Bun-Length Angus Beef Uncured Beef Franks Hot Dogs   ,$5.69,cub
309,03-3-23,meat,Johnsonville Turkey Breakfast Sausage Links  Links  ,$7.99,cub
310,03-3-23,meat,Aidells Chicken Meatballs Caramelized Onion  ,$5.99,cub
311,03-3-23,meat,Johnsonville Turkey Sausage Cheddar . ,$5.29,cub
312,03-3-23,meat,Johnsonville Summer Sausage Garlic  ,$5.79,cub
313,03-3-23,meat,Hillshire Farm Hot Links & Sausage Beef . ,$4.99,cub
314,03-3-23,meat,Culinary Circle Hard Salami Sliced  ,$8.99,cub
315,03-3-23,meat,Ambassador Wieners  ,$15.99,cub
316,03-3-23,meat,Eckrich Turkey Smoked Sausage Skinless  ,$4.99,cub
317,03-3-23,meat,Hormel Pepperoni Stix   ,$5.99,cub
318,03-3-23,meat,Schweigert Summer Sausage  ,$12.49,cub
319,03-3-23,meat,Hormel Foods Pepperoni Original   ,$2.99,cub
320,03-3-23,meat,Schweigert Summer Sausage  ,$4.49,cub
321,03-3-23,meat,Fiorucci All Natural Italian Salami  ,$6.99,cub
322,03-3-23,meat,Cacique Pork Chorizo Gluten Free  ,$2.19,cub
323,03-3-23,meat,Hormel Salami Hard  ,$5.99,cub
324,03-3-23,meat,Cub Bratwurst Smoked with Jalapeno and Cheddar  ,$3.74,cub
325,03-3-23,meat,Buddig Turkey Oven Roasted Mega Pack  ,$7.99,cub
326,03-3-23,meat,Smithfield Pork Sausage Links All Natural Hometown Original  ,$7.49,cub
327,03-3-23,meat,Kiolbassa Sausage Smoked Roasted Garlic  ,$7.99,cub
328,03-3-23,meat,Beef Ring Bologna  ,$5.99,cub
329,03-3-23,meat,Ball Park Classic Hot Dogs Resealable Package  ,$5.99,cub
330,03-3-23,meat,JENNIE-O TURKEY STORE Jennie-O® Extra Lean Smoked-Sliced Turkey Breast  oz. Package  ,$8.99,cub
331,03-3-23,meat,Ball Park Angus Beef Franks Original  ,$5.49,cub
332,03-3-23,meat,Zatarain's Cajun Style Smoked Sausage  ,$5.39,cub
333,03-3-23,meat,Old Wisconsin Sausage Sticks Hot & Spicy Medium Heat Jumbo Bag  ,$12.49,cub
334,03-3-23,meat,Essential Everyday Bacon Hardwood Smoked Thick Sliced  ,$11.99,cub
335,03-3-23,meat,SNACK Sticks  ,$11.99,cub
336,03-3-23,meat,Jimmy Dean Pork Sausage Premium Sage  ,$5.99,cub
337,03-3-23,meat,Swaggerty's Farm  All Natural Boxes Trays & Rolls Sausage Preservative Free All Natural Mild  ,$4.59,cub
338,03-3-23,meat,Oscar Mayer Selects Hardwood Smoked Uncured Turkey Sausage  ,$4.50,cub
339,03-3-23,meat,Aidells Beef Sausage Smoked Cotija Cheese & Fire-Roasted Poblano  ,$5.99,cub
340,03-3-23,meat,Culinary Circle Genoa Salami Sliced  ,$8.99,cub
341,03-3-23,meat,Oscar Mayer Uncured Jumbo Wieners Hot Dogs   ,$3.29,cub
342,03-3-23,meat,Jimmy Dean Loaded Sausage Bites Turkey Sausage Egg & Cheese . ,$3.99,cub
343,03-3-23,meat,Godshall's Beef Bacon Real Wood Smoked Cured Beef Plates  ,$10.49,cub
344,03-3-23,meat,Hormel Black Label Little Sizzlers  PoundOpen ,$12.99,cub
345,03-3-23,meat,Hormel Pepperoni Original Value Pack  ,$11.99,cub
346,03-3-23,meat,Manea's Cottage Bacon  ,$6.99,cub
347,03-3-23,meat,Eckrich  Li'l Smokes Sausage Beef Cocktail Smoked  ,$3.99,cub
348,03-3-23,meat,Johnsonville Pork Breakfast Sausage Links Original  Links  ,$7.99,cub
349,03-3-23,meat,Johnsonville Sausage Chicken Apple  ,$5.29,cub
350,03-3-23,meat,Oscar Mayer Hardwood Smoked Smokies Uncured Smoked Sausage   ,$3.29,cub
351,03-3-23,meat,Abbyland Beef Summer Sausage  ,$5.99,cub
352,03-3-23,meat,Manea's Meat Sticks Wild Rice  ,$5.99,cub
353,03-3-23,meat,Margherita Salami Genoa  ,$6.99,cub
354,03-3-23,meat,Hebrew National Beef Franks % Fat Free . ,$5.99,cub
355,03-3-23,meat,Culinary Circle Sopressata Sliced  ,$8.99,cub
356,03-3-23,meat,Old Wisconsin  Natural Cut Snack Bites Hardwood-Smoked Beef Sausage  ,$7.29,cub
357,03-3-23,meat,Old Wisconsin Sausage Sticks Hot & Spicy Medium Heat  ,$7.29,cub
358,03-3-23,meat,Hormel Ham Brown Sugar Pecan Wood Smoked  ,$5.79,cub
359,03-3-23,meat,Hormel Ham Sweet Black Peppered Pecanwood Smoked  ,$5.79,cub
360,03-3-23,meat,Hillshire Farm  Lit'l Smokies Smoked Sausage Cheddar  ,$3.99,cub
361,03-3-23,meat,Eckrich Sausage Smoked Cheddar  ,$4.99,cub
362,03-3-23,meat,Eckrich Sausage Smoked Skinless  ,$4.99,cub
363,03-3-23,meat,Cacique Beef Chorizo  ,$2.19,cub
364,03-3-23,meat,Gilbert's Sausage Chicken Aloha with Pineapple Ginger & Brown Sugar  ,$6.99,cub
365,03-3-23,meat,Johnsonville Smoked Sausage Beddar with Cheddar Party Pack   ,$9.49,cub
366,03-3-23,meat,Swaggerty's Farm Sausage Preservative Free All Natural Hot  ,$4.59,cub
367,03-3-23,meat,Oscar Mayer Selects Hardwood Smoked Uncured Beef Sausage  ,$4.50,cub
368,03-3-23,meat,Old Wisconsin Snack Sticks Turkey Sausage Honey Brown Sugar  ,$12.49,cub
