
727,03-3-23,bread,Pepperidge Farm  Bakery Classics Buns Sweet Hawaiian Sliders Mini   ,$4.29,cub
728,03-3-23,bread,Cruz Flour Tortillas  ,$5.39,cub
729,03-3-23,bread,Joseph's Wraps Flax Oat Bran & Whole Wheat  Inch   ,$3.49,cub
730,03-3-23,bread,Mission Tortilla Wraps Vegan Super Soft Protein   ,$6.49,cub
731,03-3-23,bread,Stonefire Naan Crisps Classic Cheddar  ,$4.29,cub
732,03-3-23,bread,Mission Wraps Garden Spinach Herb   ,$4.59,cub
733,03-3-23,bread,Ole  Xtreme Wellness Wraps High Fiber Large   ,$5.39,cub
734,03-3-23,bread,Village Hearth Bread Honey Wheat  ,$3.59,cub
735,03-3-23,bread,Bimbo Bimbo Soft White Bread  oz  ,$3.09,cub
736,03-3-23,bread,Mission  Super Soft Tortillas Yellow Corn Super Size   ,$2.49,cub
737,03-3-23,bread,Thomas' Thomas' Cinnamon Swirl Bread  oz  ,$4.59,cub
738,03-3-23,bread,Flatout Flatbreads Italian Herb Light   ,$3.99,cub
739,03-3-23,bread,Thomas' The original Nooks & Crannies English Muffin made with cinnamon and g of protein to jump start your day.  ,$3.99,cub
740,03-3-23,bread,Cub Bakery Rye Bread  ,$4.49,cub
741,03-3-23,bread,Cub Bakery Wholesome Harvest Oatmeal  ,$5.79,cub
742,03-3-23,bread,Village Hearth Bread Half Loaf % Whole Wheat  ,$2.89,cub
743,03-3-23,bread,Frescados Tortillas Whole Wheat   ,$6.49,cub
744,03-3-23,bread,Papas Organic Bread Mega Seeds  ,$5.89,cub
745,03-3-23,bread,Crunchmaster Crackers Multi-Grain Sea Salt  ,$4.49,cub
746,03-3-23,bread,Stacy's Pita Chips Parmesan Garlic & Herb Baked . ,$4.99,cub
747,03-3-23,bread,Frescados Flour Tortillas Taqueria Style Mini   ,$2.79,cub
748,03-3-23,bread,Papa Pita Greek Pita Flat Bread . ,$3.19,cub
749,03-3-23,bread,Cruz Flour Fajita Size Tortillas   ,$4.99,cub
750,03-3-23,bread,Snack Factory Pretzel Crisps Honey Mustard Bites  ,$6.99,cub
751,03-3-23,bread,Beefsteak Beefsteak Hearty Rye Seeded Bread  oz  ,$4.99,cub
752,03-3-23,bread,King's Hawaiian Hamburger Buns Original Hawaiian Sweet Pretzel   ,$4.99,cub
753,03-3-23,bread,Essential Everyday Flour Tortillas Soft Taco  Inch   ,$3.19,cub
754,03-3-23,bread,Village Hearth White Brat Buns Wisconsin  ,$4.29,cub
755,03-3-23,bread,Bruschetter Toasts . ,$3.99,cub
756,03-3-23,bread,Schar Hamburger Buns Gluten-Free . ,$5.99,cub
757,03-3-23,bread,Papa Pita Greek Pita  Flat Bread White . ,$3.19,cub
758,03-3-23,bread,Beefsteak Beefsteak Soft Rye Bread  oz  ,$4.99,cub
759,03-3-23,bread,Brownberry  Sandwich Thins Brownberry Honey Wheat Sandwich Thins  Rolls  oz  ,$4.29,cub
760,03-3-23,bread,La Brea Bakery Loaf Toasted Sunflower Honey  ,$6.49,cub
761,03-3-23,bread,Our Specialty  Bake House Batard Artisan Organic Multigrain  ,$5.49,cub
762,03-3-23,bread,Azteca Taco Salad Shells   ,$3.39,cub
763,03-3-23,bread,Brownberry Bread Organic % Whole Grain  ,$5.99,cub
764,03-3-23,bread,Canyon Bakehouse Bagels Gluten Free Deli White   ,$5.99,cub
765,03-3-23,bread,Crunchmaster Crackers Roasted Garlic Multi-Seed  ,$4.49,cub
766,03-3-23,bread,Guerrero Flour Tortillas With Flaxseed Carb Watch   ,$4.69,cub
767,03-3-23,bread,Stonefire  Naan Dippers Flatbreads Everything . ,$4.99,cub
768,03-3-23,bread,La Brea Bakery Loaf Italian Round  ,$7.49,cub
769,03-3-23,bread,Sara Lee  Artesano Sara Lee Artesano Golden Wheat Bakery Bread  oz  ,$3.99,cub
770,03-3-23,bread,Thomas' Bagels Cinnamon Raisin Mini   ,$5.39,cub
771,03-3-23,bread,Cruz Whole Wheat Tortillas . ,$3.29,cub
772,03-3-23,bread,Guerrero Tortillas Whole Wheat Carb Watch   ,$4.69,cub
773,03-3-23,bread,Mission Tortilla Wraps Almond Flour Original   ,$5.59,cub
774,03-3-23,bread,Guerrero Tortillas Flour Soft Taco   ,$2.79,cub
775,03-3-23,bread,Ball Park Ball Park Tailgaters White XL Sandwich Buns  count  oz  ,$4.39,cub
776,03-3-23,bread,NU Bake Phyllo Crisps Apple Cinnamon . ,$5.99,cub
777,03-3-23,bread,Brownberry Specialty Steak Rolls  Rolls  oz  ,$4.29,cub
778,03-3-23,bread,Sara Lee Sara Lee Delightful White made With Whole Grain Bread Keto Friendly  oz  ,$4.29,cub
779,03-3-23,bread,Stonefire Naan Crisps Garlic & Cheese  ,$4.29,cub
780,03-3-23,bread,Papas Organic Bread Sprouted Whole Wheat  ,$5.89,cub
781,03-3-23,bread,Flatout Flatbreads Multigrain with Flax   ,$3.99,cub
782,03-3-23,bread,Artisan Hearth Rolls French   ,$4.59,cub
783,03-3-23,bread,La Tortilla Factory Tortillas Yellow Corn & Wheat Handmade Style   ,$3.79,cub
784,03-3-23,bread,Ole Mexican Foods Olé Mexican Foods Xtreme Wellness! Tortilla Wraps Spinach & Herb -  CT   ,$5.19,cub
785,03-3-23,bread,La Banderita Corn Tortillas White   ,$2.99,cub
786,03-3-23,bread,Village Hearth Bread Italian Style Seeded  ,$3.49,cub
787,03-3-23,bread,Snack Factory Pretzels Crisps Honey Mustard & Onion Deli Style . ,$4.99,cub
788,03-3-23,bread,Stacy's Pita Chips Multigrain . ,$4.99,cub
789,03-3-23,bread,La Banderita Corn Tortillas White   ,$1.99,cub
790,03-3-23,bread,Country Hearth English Muffins % Whole Wheat Valu Pack   ,$3.79,cub
791,03-3-23,bread,Village Hearth Bread % Whole Wheat  ,$3.59,cub
792,03-3-23,bread,Mission Tortilla Wraps Cauliflower Original   ,$5.59,cub
793,03-3-23,bread,Pepperidge Farm Bread Oatmeal Whole Grain  ,$3.49,cub
794,03-3-23,bread,Snack Factory Pretzel Crisps Cinnamon Sugar Deli Style . ,$4.99,cub
795,03-3-23,bread,Stacy's Pita Thins Garlic & Herb Bake . ,$4.99,cub
796,03-3-23,bread,Village Hearth English Muffins  ,$4.09,cub
797,03-3-23,bread,Sara Lee Sara Lee Artesano Smooth Multigrain Bakery Bread  oz  ,$3.99,cub
798,03-3-23,bread,Thomas' Thomas' Apple Cinnamon Bagel  count  oz  ,$4.69,cub
799,03-3-23,bread,Mission Tortilla Wraps Sundried Tomato Basil Super Soft   ,$5.99,cub
800,03-3-23,bread,Cub Hot Dog Buns Enriched Sliced   ,$1.69,cub
801,03-3-23,bread,Village Hearth Classic White Dinner Rolls   ,$4.39,cub
802,03-3-23,bread,Brownberry Buns Keto Superior   ,$7.49,cub
803,03-3-23,bread,Pepperidge Farm Bread Jewish Rye Seedless  ,$4.99,cub
804,03-3-23,bread,Canyon Bakehouse Canyon Bakehouse Honey Whole Grain English Muffins Gluten Free English Muffins Fresh  Count  ,$5.99,cub
805,03-3-23,bread,Cub Garlic & Herb Bruschette Toasts . ,$3.99,cub
806,03-3-23,bread,Sara Lee  Artesano Sara Lee Artesano Brioche Bakery Bread  oz  ,$3.99,cub
807,03-3-23,bread,PEPPERIDGE FARM Bread Brown Sugar Cinnamon Thick Slice  ,$4.69,cub
808,03-3-23,bread,Papas Organic Bread  Grains & Seeds  ,$5.89,cub
809,03-3-23,bread,Thomas' Thomas' % Whole Wheat Bagels  count  oz  ,$4.69,cub
810,03-3-23,bread,Pepperidge Farm  Farmhouse Bread Potato  ,$4.99,cub
811,03-3-23,bread,S. Rosen's  Party Entertainers Caraway Cocktail Rye Bread  ,$4.49,cub
812,03-3-23,bread,La Perla Tortillas Handmade Locally  Inch   ,$5.49,cub
813,03-3-23,bread,Ball Park  Tailgaters Ball Park Tailgaters Sesame Seeded Sandwich Buns  count  oz  ,$4.39,cub
814,03-3-23,bread,Sara Lee  Delightful Sara Lee Delightful Soft & Smooth Wheat Bread  oz  ,$4.29,cub
815,03-3-23,bread,Mission Wraps Jalapeno Cheddar   ,$4.59,cub
816,03-3-23,bread,Dave's Killer Bread Bread Organic Good Seed  ,$7.79,cub
817,03-3-23,bread,King's Hawaiian Bread Honey Wheat Sliced . ,$4.99,cub
818,03-3-23,bread,Tumaro's  Carb Wise Wraps Garden Veggie   ,$4.99,cub
819,03-3-23,bread,Tumaros Wraps Sundried Tomato Basil   ,$4.99,cub
820,03-3-23,bread,Village Hearth Rolls Slender Rounds Classic White Pre-Sliced   ,$3.99,cub
821,03-3-23,bread,Mission Tortilla Wraps Gluten Free Spinach Herb   ,$5.59,cub
822,03-3-23,bread,Village Hearth Bread Rye Seeded  ,$4.89,cub
823,03-3-23,bread,Village Hearth Bread Premium White  ,$3.59,cub
824,03-3-23,bread,Frescados Flour Tortillas Taco Grande Style   ,$4.49,cub
825,03-3-23,bread,Snack Factory Pretzel Crisps Spicy Ranch Bites  ,$6.99,cub
826,03-3-23,bread,Crunchmaster Crackers Multi-Seed Rosemary & Olive Oil  ,$4.49,cub
827,03-3-23,bread,La Tortilla Factory Tortillas Low Carb Whole Wheat Original Size   ,$8.39,cub
828,03-3-23,bread,La Banderita White Corn Tortillas Mini Taco  ,$5.29,cub
829,03-3-23,bread,Guerrero Guerrero Tostadas -  CT . ,$3.39,cub
830,03-3-23,bread,La Brea Bakery Loaf Olive . ,$7.99,cub
831,03-3-23,bread,Ball Park Ball Park Everything Hamburger Buns  count  oz  ,$3.99,cub
832,03-3-23,bread,Joseph's Lavash Bread Flax Oat Bran & Whole Wheat   ,$3.99,cub
833,03-3-23,bread,Dave's Killer Bread Bread Organic White  ,$7.79,cub
834,03-3-23,bread,King's Hawaiian Rolls Honey Wheat   ,$4.99,cub
835,03-3-23,bread,Frescados Tortillas White Corn Taqueria Style Mini   ,$2.79,cub
836,03-3-23,bread,Frescados Wraps Spinach   ,$4.69,cub
837,03-3-23,bread,Brownberry Gourmet Rolls Ciabatta   ,$4.39,cub
838,03-3-23,bread,Crunchmaster Crackers Aged White Cheddar Flavored Multi-Grain  ,$4.49,cub
839,03-3-23,bread,Mission Tortillas Yellow Corn Low Fat Extra Thin Super Soft   ,$2.79,cub
840,03-3-23,bread,Essential Everyday Flour Tortillas Fajita  Inch   ,$2.99,cub
841,03-3-23,bread,Mission Tostadas Estilo Casero   ,$3.39,cub
842,03-3-23,bread,PEPPERIDGE FARM Bread French Toast Flavored Thick Slice  ,$4.69,cub
843,03-3-23,bread,Schar Hot Dog Rolls Soft & Sliced  ,$6.49,cub
844,03-3-23,bread,Schar Ciabatta Multigrain Artisan Style  ,$6.49,cub
845,03-3-23,bread,Village Hearth Buns Gourmet Toasted Sesame Seeds   ,$4.39,cub
846,03-3-23,bread,Frescados Wraps Tomato Basil   ,$4.69,cub
847,03-3-23,bread,NU Bake Phyllo Crisps Cranberry Oat . ,$5.99,cub
848,03-3-23,bread,Country Hearth Bread Apple Cinnamon  ,$4.69,cub
849,03-3-23,bread,Country Hearth Breakfast Breads Cinnamon Burst  ,$4.69,cub
850,03-3-23,bread,Ole Mexican Foods  Xtreme Wellness! Wraps High Fiber Spinach & Herbs Large   ,$5.69,cub
851,03-3-23,bread,Brownberry  Sandwich Thins Brownberry Vegetable Herb Cauliflower Sandwich Thin Rolls  count  oz  ,$4.29,cub
852,03-3-23,bread,Sara Lee  Artesano Bakery Rolls   ,$3.99,cub
853,03-3-23,bread,Bubbas Bagels Blueberry Sliced   ,$3.79,cub
854,03-3-23,bread,Bubbas Bagels Onion Sliced   ,$3.79,cub
855,03-3-23,bread,Bubbas Bagels Plain Sliced   ,$3.79,cub
856,03-3-23,bread,Snack Factory Pretzel Crisps Original Minis . ,$4.99,cub
857,03-3-23,bread,Tumaro's  Carb Wise Wraps Premium White   ,$4.99,cub
858,03-3-23,bread,STONEFIRE Whole Grain Naan Rounds . ,$4.99,cub
859,03-3-23,bread,Kings Hawaiian Hot Dog Buns Hawaiian Sweet   ,$4.99,cub
860,03-3-23,bread,Frescados Wraps Garlic Herb   ,$4.69,cub
861,03-3-23,bread,Guerrero Tortillas Flour Burrito   ,$4.59,cub
862,03-3-23,bread,Cub Stuffing   ,$2.99,cub
863,03-3-23,bread,Our Specialty Bread Organic Country Italian Artisan Batard  ,$5.49,cub
864,03-3-23,bread,Cub Hamburger Buns Enriched Sliced   ,$1.69,cub
865,03-3-23,bread,Bubbas Bagels Cinnamon Raisin Sliced   ,$3.79,cub
866,03-3-23,bread,Pepperidge Farm Bread Jewish Rye Seeded  ,$4.99,cub
867,03-3-23,bread,Tumaro's  Carb Wise Wraps Honey Wheat   ,$4.99,cub
868,03-3-23,bread,Pepperidge Farm  Farmhouse Bread Sweet Hawaiian  ,$4.99,cub
869,03-3-23,bread,Frescados Wraps Garden Vegetable   ,$4.69,cub
870,03-3-23,bread,Thomas' Bagels Pumpkin Spice Pre-Sliced   ,$5.49,cub
871,03-3-23,bread,Country Hearth Blueberry Bread  ,$4.69,cub
872,03-3-23,bread,Crunchmaster Baked Rice Crackers Salt & Pepper Avocado Toast . ,$4.49,cub
873,03-3-23,bread,Crunchmaster Crackers  Multi-Seed Ultimate Everything  ,$4.49,cub
874,03-3-23,bread,Brownberry Buns Potato   ,$4.29,cub
875,03-3-23,bread,Firehook Baked Crackers Organic Mediterranean Sea Salt . ,$7.99,cub
876,03-3-23,bread,La Banderita Corn Tostadas  ,$2.59,cub
877,03-3-23,bread,Mission Flour Tortillas Sweet Hawaiian   ,$2.69,cub
878,03-3-23,bread,Brownberry Buns Keto Superior   ,$7.49,cub
879,03-3-23,bread,Cracker Thins . ,$4.99,cub
880,03-3-23,bread,S. Rosen's  Party Entertainers Pumpernickel Cocktail Rye Bread  ,$4.49,cub
881,03-3-23,bread,Bimbo Bimbo % Whole Wheat Bread Made with Whole Wheat Flour  Oz  ,$4.29,cub
882,03-3-23,bread,Village Hearth Bread % Whole Wheat  ,$4.29,cub
883,03-3-23,bread,Firehook Baked Crackers Garlic Thyme . ,$7.99,cub
884,03-3-23,bread,Our Specialty  Bakehouse Artisan Baguette Organic French Demi  ,$5.49,cub
885,03-3-23,bread,Mission White Corn Tortillas . ,$5.79,cub
886,03-3-23,bread,Village Hearth Bagels % Whole Wheat Pre-Sliced   ,$4.99,cub
887,03-3-23,bread,Frescados Tortillas Gluten Free White Corn   ,$2.49,cub
888,03-3-23,bread,Flatout  CarbDown Flatbreads Olive Oil & Sea Salt   ,$3.99,cub
889,03-3-23,bread,Bubbas Bagels Sliced % Whole Wheat & Honey   ,$3.79,cub
890,03-3-23,bread,Cub Roasted Garlic Bread  ,$5.49,cub
891,03-3-23,bread,Thomas' Thomas' Chocolatey Chip Mini Bagels  count  oz  ,$5.39,cub
892,03-3-23,bread,Ener-G Ener-G Gluten-Free Multigrain with Brown Rice  ,$7.99,cub
893,03-3-23,bread,Frescados Flour Tortillas Taco Style   ,$2.79,cub
894,03-3-23,bread,La Brea Bakery Loaf Ciabatta  ,$6.99,cub
895,03-3-23,bread,Brownberry Hot Dog Buns Potato   ,$4.29,cub
896,03-3-23,bread,Cracker Thins . ,$4.99,cub
897,03-3-23,bread,Sara Lee Sara Lee Sweet Hawaiian Rolls  count  oz  ,$3.79,cub
898,03-3-23,bread,Ener-G Ener-G Gluten-Free Texas Toast with White Rice  ,$9.99,cub
899,03-3-23,bread,La Banderita Tortillas Yellow Corn . ,$5.99,cub
900,03-3-23,bread,La Tortilla Factory Tortillas Whole Wheat Low Carb Large Size   ,$5.99,cub
901,03-3-23,bread,Schar Breadsticks Italian Gluten-Free . ,$4.69,cub
902,03-3-23,bread,Stacys Pita Chips Cinnamon Sugar Baked . ,$4.99,cub
903,03-3-23,bread,Valley Produce Company Potato Crackers Thins . ,$7.99,cub
904,03-3-23,bread,Cub Bread Sandwich White Enriched  ,$2.19,cub
905,03-3-23,bread,Village Hearth Bagels Pre Sliced Cinnamon Raisin   ,$4.99,cub
906,03-3-23,bread,Village Hearth Bagels Pre Sliced Plain   ,$4.99,cub
907,03-3-23,bread,Village Hearth English Muffins White   ,$4.09,cub
908,03-3-23,bread,Lakeland Bread Enriched Sandwich Texas Toast  ,$3.99,cub
909,03-3-23,bread,Bubbas Bagels Everything with Flax Seeds Sliced   ,$3.79,cub
910,03-3-23,bread,Pepperidge Farm Bread Italian White  ,$3.39,cub
911,03-3-23,bread,Stacys Pita Chips Fire Roasted Jalapeno . ,$4.99,cub
912,03-3-23,bread,Essential Everyday Corn Tortillas Soft Taco . Inch   ,$2.29,cub
913,03-3-23,bread,Mestemacher Pumpernickel Natural . ,$4.49,cub
914,03-3-23,bread,Mestemacher Whole Rye Bread . ,$4.49,cub
915,03-3-23,bread,Sara Lee Sara Lee Artesano Maple & Brown Sugar Bakery Bread  oz  ,$4.49,cub
916,03-3-23,bread,Village Hearth Bagels Pre Sliced Blueberry   ,$4.99,cub
917,03-3-23,bread,Brownberry Brownberry Sweet Multigrain Gourmet Hamburger Buns  count  oz  ,$4.29,cub
918,03-3-23,bread,La Panzanella  Croccantini Crackers Artisan Whole Wheat Mini  ,$6.99,cub
919,03-3-23,bread,Cub Bread Enriched White Split Top  ,$2.19,cub
920,03-3-23,bread,Tumaro's Wraps  Grains and Seeds   ,$4.99,cub
921,03-3-23,bread,Black Pepper Cracker Thins . ,$4.99,cub
922,03-3-23,bread,Sara Lee  Artesano Rolls Sweet Steakhouse   ,$3.99,cub
923,03-3-23,bread,La Banderita Flour Tortillas Burrito Grande Extra Large   ,$4.79,cub
924,03-3-23,bread,Ener-G Bread Tapioca Loaf Gluten Free  ,$9.99,cub
925,03-3-23,bread,Bimbo Bimbo Soft Wheat Bread  oz  ,$3.29,cub
926,03-3-23,bread,Sara Lee Sara Lee White made with Veggies Round Top Bread  oz  ,$2.50,cub
927,03-3-23,bread,Cub Sweet Miami Onion Buns  Count   ,$2.29,cub
928,03-3-23,bread,Firehook Crackers Baked Rosemary Sea Salt . ,$7.99,cub
929,03-3-23,bread,Cub Bread Enriched White  ,$1.59,cub
930,03-3-23,bread,La Banderita Tortillas White Corn . ,$5.99,cub
931,03-3-23,bread,King's Hawaiian Bread Hawaiian Sweet Sliced . ,$4.99,cub
932,03-3-23,bread,Tumaro's Wraps Ancient Grain   ,$4.99,cub
933,03-3-23,bread,Sara Lee  Artesano Sara Lee Artesano Cinnamon Bakery Bread  oz  ,$4.49,cub
934,03-3-23,bread,Pepperidge Farm Hamburger Buns % Whole Wheat   ,$4.29,cub
935,03-3-23,bread,Cub Natural White Hamburger Bun   ,$1.99,cub
936,03-3-23,bread,Dave's Killer Bread Bread Organic Thin-Sliced . ,$6.99,cub
937,03-3-23,bread,Thomas'  Swirl Bread Pumpkin Spice  PoundOpen ,$4.79,cub
938,03-3-23,bread,Ball Park Ball Park Tailgaters Brat Buns  count  oz  ,$4.39,cub
939,03-3-23,bread,Cub Bakery Jalapeno Cheddar Focaccia   ,$3.99,cub
940,03-3-23,bread,Mission Tostadas with Tajin   ,$3.39,cub
941,03-3-23,bread,Sara Lee Sara Lee Small White Bread Small Loaf  oz  ,$2.79,cub
942,03-3-23,bread,Pepperidge Farm  Bakery Classics Hot Dog Buns Top Sliced Sweet Hawaiian   ,$4.29,cub
943,03-3-23,bread,Pepperidge Farm Bread Jewish Rye Soft  ,$4.99,cub
944,03-3-23,bread,Thomas'  Nooks & Crannies Thomas' Limited Edition Maple French Toast English Muffins  count  oz  ,$3.99,cub
945,03-3-23,bread,Village Hearth Bagels Pre Sliced Everything   ,$4.99,cub
946,03-3-23,bread,Village Hearth Hamburger Buns Sliced Wheat   ,$4.39,cub
947,03-3-23,bread,Baking Master Baking Master English Muffin Toasting Bread  oz  ,$3.69,cub
948,03-3-23,bread,Baking Master Baking Master English Muffin Toasting Bread  oz  ,$3.69,cub
949,03-3-23,bread,Baking Master Baking Master English Muffin Toasting Bread  oz  ,$3.69,cub
950,03-3-23,bread,Brownberry  Oatnut Bread Whole Grains  ,$3.99,cub
951,03-3-23,bread,Cub Bakery Chunky Cinnamon Bread   ,$4.49,cub
952,03-3-23,bread,Cub Bakery Chunky Cinnamon Bread   ,$4.49,cub
953,03-3-23,bread,Cub Bakery Chunky Cinnamon Bread   ,$4.49,cub
954,03-3-23,bread,King's Hawaiian Rolls Hawaiian Sweet Original   ,$4.99,cub
955,03-3-23,bread,Mission Flour Tortillas Soft Taco   ,$2.99,cub
956,03-3-23,bread,Thomas'  Nooks & Crannies Thomas' Plain English Muffins  count  oz  ,$3.99,cub
957,03-3-23,bread,Thomas'  Nooks & Crannies Thomas' Plain English Muffins  count  oz  ,$3.99,cub
958,03-3-23,bread,Thomas'  Nooks & Crannies Thomas' Plain English Muffins  count  oz  ,$3.99,cub
959,03-3-23,bread,Village Hearth Bread Cottage  ,$3.49,cub
960,03-3-23,bread,Country Hearth Bread  Grain Dakota Style  ,$3.79,cub
961,03-3-23,bread,New French Bakery Artisan Bread Take & Bake French Baguette Twin Pack  ,$4.99,cub
962,03-3-23,bread,Cub Bakery Goldmine Sliced Sourdough  ,$5.69,cub
963,03-3-23,bread,Cub Bakery Goldmine Sliced Sourdough  ,$5.69,cub
964,03-3-23,bread,Cub Bakery Goldmine Sliced Sourdough  ,$5.69,cub
965,03-3-23,bread,Thomas' Thomas' Plain Bagels  count  oz  ,$4.69,cub
966,03-3-23,bread,St. Pierre Brioche Burger Buns Pre-Sliced   ,$5.99,cub
967,03-3-23,bread,Cub Bakery Vienna Bread   ,$2.99,cub
968,03-3-23,bread,Cub Bakery Vienna Bread   ,$2.99,cub
969,03-3-23,bread,Cub Bakery Vienna Bread   ,$2.99,cub
970,03-3-23,bread,Sara Lee Sara Lee Honey Wheat Bread  oz  ,$3.69,cub
971,03-3-23,bread,Country Hearth Bread Split Top Wheat Hearty Homestyle  ,$4.79,cub
972,03-3-23,bread,Country Hearth Bread Split Top Wheat Hearty Homestyle  ,$4.79,cub
973,03-3-23,bread,Country Hearth Bread Split Top Wheat Hearty Homestyle  ,$4.79,cub
974,03-3-23,bread,Sara Lee Sara Lee Artesano Bakery Bread  oz  ,$3.99,cub
975,03-3-23,bread,Cub Hamburger Buns  Count  ,$1.69,cub
976,03-3-23,bread,Cub Bakery Croissants   ,$4.99,cub
977,03-3-23,bread,New French Bakery Artisan Bread Take & Bake French Baguette . ,$3.49,cub
978,03-3-23,bread,Cub Bakery White  Hamburger Buns   ,$3.99,cub
979,03-3-23,bread,Village Hearth Hamburger Buns Old Fashioned  ,$3.59,cub
980,03-3-23,bread,Mission  Carb Balance Tortilla Wraps Flour   ,$5.99,cub
981,03-3-23,bread,Cub Bakery French Bread   ,$2.99,cub
982,03-3-23,bread,Cub Hot Dog Buns  Count  ,$1.69,cub
983,03-3-23,bread,Garden Fresh Gourmet Original Tortilla Chips Salted Corn Chips  ,$4.99,cub
984,03-3-23,bread,Garden Fresh Gourmet Original Tortilla Chips Salted Corn Chips  ,$4.99,cub
985,03-3-23,bread,Garden Fresh Gourmet Original Tortilla Chips Salted Corn Chips  ,$4.99,cub
986,03-3-23,bread,Brownberry Brownberry Whole Grains  Grain Bread  oz  ,$3.99,cub
987,03-3-23,bread,Cub Bakery Garlic Bread   ,$3.99,cub
988,03-3-23,bread,Breadsmith Pretzel Bun   ,$1.49,cub
989,03-3-23,bread,Sara Lee Bread Butter  ,$3.79,cub
990,03-3-23,bread,Brownberry Bread % Whole Wheat  ,$3.99,cub
991,03-3-23,bread,Cub Bakery Fresh Baked Baguette   ,$1.99,cub
992,03-3-23,bread,Pepperidge Farm Bread Whole Grain Dark Wheat German  ,$3.49,cub
993,03-3-23,bread,Cub Bread Enriched White Round Top  ,$2.19,cub
994,03-3-23,bread,Breadsmith French Roll   ,$1.09,cub
995,03-3-23,bread,Country Hearth Bread Variety White Special Formula  ,$3.49,cub
996,03-3-23,bread,Cub Bakery White Dinner Rolls   ,$3.99,cub
997,03-3-23,bread,Country Hearth Big % Wheat Bread  ,$3.49,cub
998,03-3-23,bread,Dave's Killer Bread Bread Organic Powerseed  ,$7.79,cub
999,03-3-23,bread,Pepperidge Farm  Swirl Bread Raisin Cinnamon  ,$4.69,cub
1000,03-3-23,bread,Pretzel Crisps Pretzel Crackers Original Deli Style . ,$4.99,cub
1001,03-3-23,bread,Ball Park Ball Park White Hot Dog Buns  count  oz  ,$3.69,cub
1002,03-3-23,bread,Village Hearth Hot Dog Buns  ,$3.59,cub
1003,03-3-23,bread,Mission  Super Soft Tortillas Flour Large Burrito   ,$3.99,cub
1004,03-3-23,bread,New French Bakery Rolls Dinner French Take & Bake  ,$5.99,cub
1005,03-3-23,bread,Cub Bakery New French Baguette  ,$2.99,cub
1006,03-3-23,bread,Cub Bakery White Silver Dollar Buns   ,$3.99,cub
1007,03-3-23,bread,Breadsmith Demi Baguette   ,$2.10,cub
1008,03-3-23,bread,New French Bakery  Take and Bake Ciabatta Rolls  ,$5.99,cub
1009,03-3-23,bread,Village Hearth Hamburger Buns Old Fashioned Sesame  ,$3.59,cub
1010,03-3-23,bread,Mission Flour Tortillas Soft Taco Style   ,$4.19,cub
1011,03-3-23,bread,Ball Park Ball Park White Hamburger Buns  count  oz  ,$3.69,cub
1012,03-3-23,bread,Thomas' Thomas' Light Multi-Grain English Muffins  count  oz  ,$3.99,cub
1013,03-3-23,bread,Breadsmith Mini Ciabatta   ,$2.10,cub
1014,03-3-23,bread,Sara Lee  Soft & Smooth Sara Lee White made with Whole Grain Bread  oz  ,$3.69,cub
1015,03-3-23,bread,Mission Flour Tortillas Soft Taco Super Soft   ,$6.49,cub
1016,03-3-23,bread,Breadsmith French Boule   ,$6.49,cub
1017,03-3-23,bread,King's Hawaiian Rolls Hawaiian Sweet Original Party Pack   ,$8.99,cub
1018,03-3-23,bread,New England Bread Brown  ,$4.99,cub
1019,03-3-23,bread,Stonefire Naan Crisps Sea Salt  ,$4.29,cub
1020,03-3-23,bread,Lakeland Hamburger Buns Jumbo   ,$4.39,cub
1021,03-3-23,bread,Snack Factory Pretzel Crisps Original Party Size  ,$6.99,cub
1022,03-3-23,bread,Breadsmith Pretzel BreadStick   ,$1.99,cub
1023,03-3-23,bread,Country Hearth Breakfast Breads Toasting English Muffin  ,$4.29,cub
1024,03-3-23,bread,Frescados Flour Tortillas Burrito Style Small Family Pack   ,$4.49,cub
1025,03-3-23,bread,Breadsmith Sourdough   ,$6.49,cub
1026,03-3-23,bread,Breadsmith Flazseed Farmers Wheat With Cranberries Roll   ,$1.39,cub
1027,03-3-23,bread,Sara Lee Sara Lee % Whole Wheat Bread  oz  ,$3.79,cub
1028,03-3-23,bread,Thomas' Bagels Plain Pre-Sliced Mini   ,$5.39,cub
1029,03-3-23,bread,Cub Bakery Breadsmith French Baguette   ,$4.79,cub
1030,03-3-23,bread,La Banderita Flour Tortillas Soft Taco Large   ,$2.99,cub
1031,03-3-23,bread,Stonefire Flatbreads Original . ,$4.99,cub
1032,03-3-23,bread,King's Hawaiian Rolls Savory Butter   ,$4.99,cub
1033,03-3-23,bread,Cub Bread Wheat Berry  ,$3.29,cub
1034,03-3-23,bread,Cub Bakery Bolillo Rolls   ,$3.49,cub
1035,03-3-23,bread,PEPPERIDGE FARM Bread Cinnamon  ,$4.69,cub
1036,03-3-23,bread,Cub Bakery Unsliced Twin French Bread Loaves   ,$2.99,cub
1037,03-3-23,bread,Mission Flour Tortillas Fajita   ,$3.79,cub
1038,03-3-23,bread,Cub Bakery Wheat Hamburger Buns   ,$3.99,cub
1039,03-3-23,bread,Village Hearth Bread Light  Grain  ,$4.49,cub
1040,03-3-23,bread,Stroehmann D'Italiano Italian Bread  ,$3.19,cub
1041,03-3-23,bread,Frescados Tortillas Flour Burrito Style   ,$4.39,cub
1042,03-3-23,bread,Brownberry Brownberry Premium Italian Bread  oz  ,$3.49,cub
1043,03-3-23,bread,PEPPERIDGE FARM Butter Bread  ,$4.99,cub
1044,03-3-23,bread,Cub Bakery Wholesome Harvest  Grain  ,$5.79,cub
1045,03-3-23,bread,Cub Bakery Hoagie Buns   ,$3.99,cub
1046,03-3-23,bread,Cub Bakery Sliced Dutchy Crust Vienna Bread   ,$3.99,cub
1047,03-3-23,bread,PEPPERIDGE FARM Bread Hearty White  ,$4.99,cub
1048,03-3-23,bread,Thomas' Thomas' Everything Bagels  count  oz  ,$4.69,cub
1049,03-3-23,bread,Mission Tortillas Yellow Corn   ,$2.49,cub
1050,03-3-23,bread,Stonefire Naan Original  Pack   ,$3.99,cub
1051,03-3-23,bread,King's Hawaiian Hawaiian Sweet Rolls Original   ,$1.99,cub
1052,03-3-23,bread,Stacy's Pita Chips Simply Naked Baked Sharing Size  ,$8.99,cub
1053,03-3-23,bread,Cub Bakery Bolilo Telera Roll   ,$0.89,cub
1054,03-3-23,bread,New French Bakery Artisan Bread CiabattaTake & Bake  ,$4.49,cub
1055,03-3-23,bread,Breadsmith Flazseed Farmers Wheat With Cranberries Loaf   ,$7.49,cub
1056,03-3-23,bread,Mission Tortillas Whole Wheat Street Tacos   ,$3.99,cub
1057,03-3-23,bread,Cub Bakery Marble Rye Bread Sliced  ,$4.49,cub
1058,03-3-23,bread,Breadsmith Vanila Egg Bun   ,$1.39,cub
1059,03-3-23,bread,Lakeland Hot Dog Buns Jumbo   ,$4.39,cub
1060,03-3-23,bread,Breadsmith French Peasant   ,$6.49,cub
1061,03-3-23,bread,La Banderita Flour Tortillas Family Pack   ,$4.19,cub
1062,03-3-23,bread,Thomas' English Muffins Cinnamon Raisin   ,$3.99,cub
1063,03-3-23,bread,King's Hawaiian Slider Buns Hawaiian Sweet Pre-Sliced   ,$4.99,cub
1064,03-3-23,bread,Stonefire Naan Original Mini  Pack   ,$3.99,cub
1065,03-3-23,bread,Village Hearth Bread Light Italian  ,$4.49,cub
1066,03-3-23,bread,Cub Bakery White Hot Dog Buns   ,$3.99,cub
1067,03-3-23,bread,Country Hearth Bread White Whole Grain  ,$3.49,cub
1068,03-3-23,bread,Stacy's Pita Thins Sea Salt Baked . ,$4.99,cub
1069,03-3-23,bread,Cub Mini Croissants  Count   ,$4.99,cub
1070,03-3-23,bread,Brownberry Brownberry Natural Wheat Bread  oz  ,$5.29,cub
1071,03-3-23,bread,Village Hearth Bread Rye Pumpernickel  ,$4.89,cub
1072,03-3-23,bread,Thomas' Thomas' % Whole Wheat English Muffins  count  oz  ,$3.99,cub
1073,03-3-23,bread,Brownberry Buns % Whole Wheat   ,$4.29,cub
1074,03-3-23,bread,Country Hearth Breads Cinnamon Raisin Breakfast  ,$4.69,cub
1075,03-3-23,bread,Cub Bakery New French Roasted Garlic  ,$5.99,cub
1076,03-3-23,bread,Crunchmaster Crackers Original Multi-Seed Party Pack  ,$9.49,cub
1077,03-3-23,bread,Joseph's Pita Bread Flax Oat Bran & Whole Wheat   ,$3.99,cub
1078,03-3-23,bread,Take N' Bake Italian Batard  ,$4.99,cub
1079,03-3-23,bread,Village Hearth Bread Light Honey Wheat  ,$4.49,cub
1080,03-3-23,bread,Sara Lee Bread Classic White  GramOpen ,$3.29,cub
